winner,loser,white_pieces,black_pieces,moves,evaluations,material_advantage,move_count
Draw,Draw,Stockfish,Stockfish,"e7e5, g1f3, b8c6, f1b5, a7a6, b5a4, g8f6, e1g1, b7b5, a4b3, f8e7, a2a4, c8b7, d2d3, e8g8, f1e1, d7d6, c1d2, b5b4, c2c3, b4c3, d2c3, a6a5, d3d4, c6b4, c3b4, a5b4, b1d2, e5d4, f3d4, g7g6, d1c2, a8a5, h2h3, g8g7, b3c4, d8a8, c4b5, c7c5, d4f3, a5a7, a1d1, g7g8, b2b3, f8d8, b5f1, f6e8, h3h4, a8c8, c2c1, e8f6, f1c4, f6h5, c4f1, c8g4, g2g3, e7f8, f3h2, g4c8, d2c4, h5f6, c1f4, c8e6, f1h3, e6e7, h3g2, a7a6, h2f3, f6h5, f4d2, h5f6, d2f4, f6h5, f4c1, e7c7, e4e5, d6d5, c4e3, c7c8, f3h2, c8e6, d1d3, b7a8, g2f3, a6a7, e1d1, a7d7, c1d2, d5d4, e3c4, d7e7, f3a8, d8a8, d2c2, h5g7, d1e1, a8d8, h2f3, g7f5, d3d1, h7h6, c2d3, e7c7, f3d2, f5e7, d2e4, e7d5, h4h5, g6g5, d1a1, c7a7, a4a5, f8e7, e4d6, d5c3, g1h2, g5g4, d6f5, d8a8, e1f1, e7g5, h2g2, a8f8, g2h2, f8a8, h2g2, g5d8, f2f3, d8a5, f3g4, a5d8, a1e1, d8g5, g2h3, c3d5, c4d6, d5e3, f5e3, d4e3, f1f5, a8d8, d3f1, e6d5, f5g5, h6g5, f1f5, d8d6, e5d6, d5f5, g4f5, a7d7, e1e3, d7d6, h3g4, g8g7, g4g5, f7f6, g5h4, g7f7, g3g4, d6d1, h4g3, d1c1, g3f4, c1c2, f4g3, c2c3, g3f4, c3c2, e3e6, c2f2, f4g3, f2b2, e6e3, f7g7, e3e7, g7f8, e7b7, b2b3, g3f4, b3h3, f4e4, h3g3, e4d5, f8g8, d5e6, g3g4, e6f6, g4g1, b7b8, g8h7, b8b7, h7h6, b7b8, h6h7, b8b5, g1a1, f6g5, a1g1, g5f6, g1a1, f6e6, c5c4, b5b4, a1a6, e6f7, h7h6, f5f6, c4c3, b4c4, a6a7, f7e6, a7a6, e6f7, a6a7, f7f8, h6h5, c4c6, h5g6, f6f7, g6h7, c6c8, h7g6, c8c6, g6h7, c6c3, a7a8, f8e7, a8a7, e7e8, a7a8, e8e7, a8a7, e7e8, a7a8, e8d7, h7g7, d7e7, a8a7, e7e8, a7a8, e8e7, a8a7, e7e8, a7a8, e8e7, a8a7, e7e8, a7a8, e8e7, a8a7, e7e8, a7a8, e8e7","[0.0038, 0.0034, 0.0028, 0.003, 0.0039, 0.0036, 0.0035, 0.0042, 0.0038, 0.0046, 0.0042, 0.0051, 0.0048, 0.0043, 0.0035, 0.0038, 0.0041, 0.0033, 0.0037, 0.0038, 0.0039, 0.0023, 0.0032, 0.0022, 0.0039, 0.0043, 0.0033, 0.0042, 0.0033, 0.0044, 0.005, 0.0044, 0.0043, 0.0047, 0.005, 0.005, 0.005, 0.0055, 0.0051, 0.0042, 0.005, 0.0048, 0.0065, 0.0045, 0.0046, 0.0056, 0.0054, 0.006, 0.0067, 0.0067, 0.0065, 0.0063, 0.0038, 0.004, 0.0077, 0.0066, 0.0069, 0.0071, 0.008, 0.0076, 0.0077, 0.0065, 0.0076, 0.0071, 0.0069, 0.0077, 0.0086, 0.0081, 0.008, 0.0085, 0.0079, 0.0078, 0.0082, 0.0074, 0.0064, 0.0081, 0.0063, 0.0066, 0.0063, 0.007, 0.0078, 0.0082, 0.0072, 0.0065, 0.0064, 0.0062, 0.0066, 0.0066, 0.006, 0.0049, 0.0054, 0.0058, 0.0063, 0.0073, 0.0078, 0.0083, 0.0084, 0.0078, 0.0076, 0.0081, 0.0068, 0.0068, 0.0063, 0.0054, 0.0075, 0.0068, 0.0077, 0.008, 0.0079, 0.007, 0.007, 0.0082, 0.0085, 0.0083, 0.0078, 0.0074, 0.006, 0.0067, 0.0073, 0.0078, 0.007, 0.0067, 0.0079, 0.0067, 0.0082, 0.0065, 0.0068, 0.0056, 0.0065, 0.0083, 0.0082, 0.008, 0.0065, 0.0072, 0.0055, 0.007, 0.0071, 0.0061, 0.0067, 0.0056, 0.0076, 0.006, 0.0071, 0.0096, 0.0084, 0.007, 0.0069, 0.005, 0.0053, 0.0043, 0.0038, 0.0027, 0.0023, 0.0021, 0.0018, 0.0036, 0.0038, 0.0017, 0.0015, 0.0011, 0.001, 0.0015, 0.0008, 0.0012, 0.0014, 0.0009, 0.0015, 0.0003, 0.0003, 0.0002, 0.0003, 0.0001, 0.0002, 0.0005, 0.0006, 0.0005, 0.0002, 0.0, 0.0, 0.0, 0.0, 0.0, 0.0, 0.0, 0.0, 0.0, 0.0, 0.0, 0.0, 0.0, 0.0, 0.0, 0.0, 0.0, 0.0, 0.0, 0.0, 0.0, 0.0, 0.0, 0.0, 0.0, 0.0, 0.0, 0.0, 0.0, 0.0, 0.0, 0.0, 0.0, 0.0, 0.0, 0.0, 0.0, 0.0, 0.0, 0.0, 0.0, 0.0, 0.0, 0.0, 0.0, 0.0, 0.0, 0.0, 0.0, 0.0, 0.0, 0.0, 0.0, 0.0, 0.0, 0.0, 0.0, 0.0, 0.0, 0.0, 0.0, 0.0, 0.0, 0.0, 0.0, 0.0, 0.0, 0.0, 0.0, 0.0, 0.0, 0.0, 0.0, 0.0, 0.0, 0.0, 0.0]","0, 0, 0, 0, 0, 0, 0, 0, 0, 0, 0, 0, 0, 0, 0, 0, 0, 0, 0, 0, -1, 0, 0, 0, 0, 3, 0, 0, -1, 0, 0, 0, 0, 0, 0, 0, 0, 0, 0, 0, 0, 0, 0, 0, 0, 0, 0, 0, 0, 0, 0, 0, 0, 0, 0, 0, 0, 0, 0, 0, 0, 0, 0, 0, 0, 0, 0, 0, 0, 0, 0, 0, 0, 0, 0, 0, 0, 0, 0, 0, 0, 0, 0, 0, 0, 0, 0, 0, 0, 0, 0, 3, 0, 0, 0, 0, 0, 0, 0, 0, 0, 0, 0, 0, 0, 0, 0, 0, 0, 0, 0, 0, 0, 0, 0, 0, 0, 0, 0, 0, 0, 0, 0, 0, 0, 0, 0, 0, -1, 0, 0, 0, 0, 0, 0, 0, 0, 3, 0, 0, 0, 0, 0, 3, -2, -2, -5, 0, -9, 0, 0, 1, 0, 0, 0, 1, 1, 1, 1, 1, 1, 1, 1, 1, 1, 1, 1, 1, 1, 1, 1, 1, 1, 1, 1, 1, 1, 1, 0, 0, 0, 0, 0, 0, 0, 0, -1, 0, 0, 0, 0, 0, 0, 0, 0, 0, 0, 0, 0, 0, 0, 0, 0, 1, 1, 1, 1, 1, 1, 1, 1, 1, 1, 1, 1, 1, 0, 0, 0, 0, 0, 0, 0, 0, 0, 1, 1, 1, 1, 1, 1, 1, 1, 1, 1, 1, 1, 1, 1, 1, 1, 1, 1, 1, 1, 1, 1, 1, 1, 1, 1, 1, 1, 1",254
White,Black,Stockfish,Stockfish,"c2c3, d4c2, d1c2, e7e5, g1f3, d7d5, f3e5, d8e7, d2d4, f7f6, e5d3, e7e4, c1e3, f8d6, b1d2, e4e6, e1c1, g8e7, e3f4, b8c6, d1e1, e6f7, f4d6, c7d6, h2h4, e8g8, h4h5, c8f5, d2f3, a8c8, c2d2, b7b5, c1b1, a7a5, b1a1, b5b4, d3f4, c8b8, f3h4, b4c3, b2c3, f5d7, f1d3, f6f5, h4f3, h7h6, f3h4, a5a4, e1b1, a4a3, g2g3, c6a5, h4g6, f8e8, b1b8, e8b8, d2c1, e7g6, h5g6, f7f8, c1a3, a5b3, a2b3, b8a8, a3a8, f8a8, a1b2, a8e8, h1a1, d7c6, d3f5, e8b8, a1e1, g8f8, f4e6, f8g8, e6f4, g8f8, f5c2, c6d7, f4d5, d7c6, d5f4, b8b5, b3b4, b5b6, f4e6, f8g8, f2f4, b6b8, c2b3, g8h8, f4f5, h6h5, e6g5, d6d5, e1e5, b8b5, g5f7, h8g8, f7d6, b5b8, b3d5, c6d5, e5e8, b8e8, d6e8, g8f8, e8d6, d5g8, c3c4, f8e7, c4c5, g8d5, b4b5, e7f8, c5c6, f8e7, c6c7, d5b7, d6b7, e7d7, b5b6, d7e7, b7d6, e7f6, c7c8q, f6g5, f5f6, g5h6, f6f7, h6g6, f7f8q, h5h4, c8f5, g6h6, d6f7","[0.0243, 0.0171, 0.0099, 0.0081, 0.0088, 0.0112, 0.0112, 0.01, 0.011, 0.0103, 0.0109, 0.0098, 0.0097, 0.0101, 0.0104, 0.0103, 0.0104, 0.0106, 0.0112, 0.0107, 0.0096, 0.0097, 0.0096, 0.009, 0.0105, 0.0089, 0.0106, 0.0091, 0.0102, 0.0121, 0.0127, 0.0127, 0.0114, 0.0125, 0.0129, 0.0132, 0.0129, 0.0115, 0.0158, 0.0167, 0.0163, 0.0163, 0.0168, 0.0178, 0.0169, 0.0179, 0.0183, 0.0175, 0.0169, 0.0163, 0.0164, 0.0158, 0.0229, 0.0176, 0.0216, 0.0214, 0.0229, 0.0225, 0.0246, 0.0251, 0.025, 0.0266, 0.0276, 0.0269, 0.027, 0.0285, 0.0282, 0.0294, 0.0307, 0.0332, 0.0338, 0.0352, 0.036, 0.0366, 0.037, 0.0366, 0.0355, 0.039, 0.0385, 0.038, 0.0393, 0.0393, 0.0383, 0.0493, 0.044, 0.0441, 0.048, 0.0484, 0.0516, 0.0531, 0.055, 0.0559, 0.0544, 0.054, 0.0601, 0.061, 0.0647, 0.0606, 0.0643, 0.0652, 0.0699, 0.0689, 0.0692, 0.0731, 0.0732, 0.0734, 0.0735, 0.0745, 0.0759, 0.077, 0.0752, 0.081, 0.0825, 0.0853, 0.0866, 0.1224, 0.1886, 0.2238, 0.4128, 0.9988, 0.999, 0.9992, 0.9993, 0.9993, 0.9994, 0.9994, 0.9995, 0.9995, 0.9996, 0.9996, 0.9997, 0.9997, 0.9998, 0.9998, 0.9999, 0.9999, 1.0]","-3, -3, 0, 0, 0, 0, 1, 1, 1, 1, 1, 0, 0, 0, 0, 0, 0, 0, 0, 0, 0, 0, 3, 0, 0, 0, 0, 0, 0, 0, 0, 0, 0, 0, 0, 0, 0, 0, 0, -1, 0, 0, 0, 0, 0, 0, 0, 0, 0, 0, 0, 0, 0, 0, 5, 0, 0, -3, 0, 0, 1, 1, 4, 4, 9, 0, 0, 0, 0, 0, 1, 1, 1, 1, 1, 1, 1, 1, 1, 1, 2, 2, 2, 2, 2, 2, 2, 2, 2, 2, 2, 2, 2, 2, 2, 2, 2, 2, 2, 2, 2, 2, 3, 0, 0, -5, 4, 4, 4, 4, 4, 4, 4, 4, 4, 4, 4, 4, 4, 4, 7, 7, 7, 7, 7, 7, 15, 15, 15, 15, 15, 14, 22, 22, 22, 22, 22",137
White,Black,Stockfish,Stockfish,"c7c5, g1f3, d7d6, d2d4, g8f6, b1c3, c5d4, f3d4, a7a6, c1e3, f6g4, e3g5, h7h6, g5h4, g7g5, h4g3, f8g7, h2h3, g4e5, d4f5, c8f5, e4f5, b8d7, f1e2, d7f6, e1g1, e8g8, g3e5, d6e5, e2d3, d8b6, a1b1, a8d8, f1e1, d8d7, d1f3, f8d8, g2g3, b6c7, a2a3, b7b5, e1e3, d7d4, b1e1, f6d7, d3e4, d7f6, e3e2, g8f8, e4d3, f6d7, c3e4, d7f6, g1g2, f8g8, e1d1, c7d7, e2e1, f6e4, e1e4, d4d6, b2b3, g7f6, a3a4, d7c7, a4b5, a6b5, d1a1, g8g7, a1a2, d6d5, e4b4, c7b6, a2a8, e5e4, f3e4, d5e5, e4f3, d8a8, f3a8, h6h5, g3g4, h5h4, d3f1, b6c5, b4b5, c5c2, b5e5, f6e5, a8d5, e5g3, d5d4, f7f6, f1c4, g7h6, g2f3, g3d6, d4e4, c2d2, e4a8, d2f4, f3e2, d6b8, e2d3, f4h2, f2f3, h2d6, c4d5, d6f4, a8a4, f4e5, a4a8, e5f4, a8a4, f4e5, a4c6, b8a7, d3c4, e5e2, c4b4, e2d2, b4b5, d2e2, c6c4, e2e5, b3b4, e5b8, b5a4, a7f2, c4b5, b8a7, b5a5, a7d7, a4a3, f2a7, d5e4, h6g7, a5d5, d7d6, d5c6, d6d8, e4d5, a7g1, a3a4, g1d4, c6e6, d8f8, b4b5, f8e8, d5c6, e8f8, c6d5, f8e8, d5c6, e8f8, e6d7, d4b6, a4b3, f8f7, c6d5, f7f8, d7e6, b6a5, b3a4, a5c3, b5b6, f8e8, e6c6, e8c6, d5c6, g7f7, c6d7, e7e6, f5e6, f7e7, a4b5, c3e5, b5a6, e7d8, d7c6, e5f4, a6b7, f4e3, c6e4, e3g1, e6e7, d8e7, b7c7, g1b6, c7b6, e7e6, b6c6, e6e5, c6d7, e5d4, d7e6, f6f5, e6f5, d4c3, f3f4, g5f4, f5f4, c3b2, g4g5, b2a1, g5g6, a1b2, g6g7, b2b3, g7g8q, b3c3, f4e5, c3b2, g8c4, b2a3, c4b5, a3a2, b5b4, a2a1, b4b1","[0.0038, 0.0043, 0.0042, 0.0043, 0.0042, 0.0031, 0.0032, 0.0036, 0.0038, 0.0037, 0.0029, 0.0027, 0.0037, 0.0035, 0.0034, 0.0035, 0.0035, 0.0042, 0.0036, 0.003, 0.0038, 0.0025, 0.0035, 0.0037, 0.0028, 0.0032, 0.0032, 0.0026, 0.003, 0.0028, 0.0026, 0.0025, 0.0024, 0.0025, 0.0023, 0.002, 0.0024, 0.0025, 0.0025, 0.0023, 0.0024, 0.0032, 0.003, 0.0023, 0.002, 0.0023, 0.0022, 0.0024, 0.0018, 0.0023, 0.0025, 0.0024, 0.0023, 0.0022, 0.0029, 0.003, 0.0035, 0.003, 0.0038, 0.0025, 0.0022, 0.0025, 0.0023, 0.0018, 0.0024, 0.0025, 0.0023, 0.0041, 0.0036, 0.0042, 0.0044, 0.0046, 0.0053, 0.0038, 0.0058, 0.005, 0.0048, 0.0049, 0.0048, 0.0037, 0.0032, 0.0014, 0.0011, 0.0033, 0.0062, 0.003, 0.0042, 0.0061, 0.0062, 0.007, 0.0075, 0.0077, 0.0055, 0.0071, 0.0077, 0.0077, 0.0085, 0.0084, 0.0093, 0.0095, 0.01, 0.0095, 0.0096, 0.0099, 0.0095, 0.0093, 0.01, 0.0097, 0.01, 0.0104, 0.01, 0.0075, 0.0088, 0.0075, 0.0077, 0.0075, 0.0078, 0.0071, 0.0075, 0.0078, 0.0073, 0.0104, 0.012, 0.0147, 0.0146, 0.012, 0.0149, 0.015, 0.0173, 0.0171, 0.0159, 0.0165, 0.0168, 0.0182, 0.0183, 0.0196, 0.0198, 0.0195, 0.0203, 0.019, 0.0184, 0.0195, 0.0208, 0.0213, 0.0201, 0.0232, 0.024, 0.0274, 0.0255, 0.0274, 0.0276, 0.0275, 0.0256, 0.0203, 0.0252, 0.0231, 0.02, 0.0235, 0.0278, 0.0316, 0.0282, 0.0316, 0.0329, 0.0348, 0.0357, 0.0366, 0.0398, 0.0442, 0.0445, 0.0476, 0.0485, 0.0521, 0.0525, 0.0532, 0.0488, 0.0551, 0.0539, 0.0549, 0.0553, 0.0585, 0.0551, 0.06, 0.0621, 0.0632, 0.0639, 0.0655, 0.0639, 0.0691, 0.0704, 0.0738, 0.0758, 0.1049, 0.3656, 0.3894, 0.4304, 0.9974, 0.9979, 0.9985, 0.9985, 0.9989, 0.9989, 0.999, 0.999, 0.9991, 0.9991, 0.9992, 0.9992, 0.9993, 0.9993, 0.9994, 0.9995, 0.9996, 0.9996, 0.9997, 0.9997, 0.9998, 0.9998, 0.9999, 0.9999, 1.0]","0, 0, 0, 0, 0, 0, -1, 0, 0, 0, 0, 0, 0, 0, 0, 0, 0, 0, 0, 0, -3, 0, 0, 0, 0, 0, 0, 3, 0, 0, 0, 0, 0, 0, 0, 0, 0, 0, 0, 0, 0, 0, 0, 0, 0, 0, 0, 0, 0, 0, 0, 0, 0, 0, 0, 0, 0, 0, -3, 0, 0, 0, 0, 0, 0, 1, 0, 0, 0, 0, 0, 0, 0, 0, 0, 1, 1, 1, -4, 1, 1, 1, 1, 1, 1, 2, 1, 6, 1, 1, 1, 1, 1, 1, 1, 1, 1, 1, 1, 1, 1, 1, 1, 1, 1, 1, 1, 1, 1, 1, 1, 1, 1, 1, 1, 1, 1, 1, 1, 1, 1, 1, 1, 1, 1, 1, 1, 1, 1, 1, 1, 1, 1, 1, 1, 1, 1, 1, 1, 1, 1, 1, 1, 1, 1, 1, 1, 1, 1, 1, 1, 1, 1, 1, 1, 1, 1, 1, 1, 1, 1, 1, 1, 1, 1, 1, 1, 1, -8, 1, 1, 1, 1, 2, 2, 2, 2, 2, 2, 2, 2, 2, 2, 2, 2, 2, 1, 1, 0, 3, 3, 3, 3, 3, 3, 3, 3, 4, 4, 4, 3, 4, 4, 4, 4, 4, 4, 4, 4, 12, 12, 12, 12, 12, 12, 12, 12, 12, 12, 12",220
Draw,Draw,Stockfish,Stockfish,"d6d5, b1c3, g8f6, c1g5, d5e4, c3e4, f8e7, g5f6, g7f6, g1f3, f6f5, e4c3, a7a6, g2g3, b7b5, f1g2, c8b7, d1e2, b5b4, c3a4, d8d5, e1g1, d5b5, e2e5, e8g8, b2b3, b5e5, f3e5, b7g2, g1g2, f8d8, f1d1, e7f6, f2f4, f6e5, d4e5, b8c6, a1c1, h7h5, g2f3, a6a5, d1d3, c6e7, d3d8, a8d8, f3e2, h5h4, c2c4, b4c3, c1c3, g8g7, c3c5, d8a8, e2f3, a8a7, a4c3, c7c6, c3a4, e7d5, a4b2, g7g6, b2c4, a5a4, c5a5, a7d7, a5a4, d5c3, a4a8, d7d3, f3g2, c3d5, a8g8, g6h7, g8a8, h7g6, a8g8, g6h7, g8b8, h7g6, g3h4, d5f4, g2f2, d3c3, a2a4, f4d3, f2e2, d3c5, c4d2, f5f4, a4a5, c3e3, e2d1, f4f3, b8g8, g6h6, g8g3, c5b3, d2f3, b3a5, f3g5, a5c4, g5f7, h6h5, g3e3, c4e3, d1d2, e3g4, f7d8, g4e5, d8e6, c6c5, e6c5, h5h4, d2e3, e5c4, e3d4, h4h3, c5e6, h3h2, e6f4, h2g1, f4e2, g1f2, d4d3, f2f3, e2d4, f3f4, d4e2, f4e5, e2f4, c4b2, d3e3, b2c4, e3d3, c4b2, d3e3, b2d1, e3d3, d1f2, d3e3, f2g4, e3d2, e5e4, d2c3, g4f2, c3c4, f2d1, f4e2, d1b2, c4c5, b2d3, c5d6, d3e5, e2c3, e4d4, c3e2, d4e4, e2c3, e4d3, c3b5, e5f3, b5d4, d3c4, d4b3, c4d3, d6d5, f3e5, b3c5, d3e3, c5b3, e5d7, b3d4, d7b6, d5d6, b6a4, d6d5, a4b6, d5d6, b6a4, d4e6, e3e2, e6f4, e2e3, f4e2, a4b2, e2f4, b2c4, d6c5, c4e5, c5d6, e5c4, d6c5, c4e5, c5d5, e5d7, f4g2, e3f3, g2f4, d7b6, d5d6, b6c4, d6c5, f3e4, f4e2, e4e5, e2c3, c4b6, c3e4, b6d5, e4d6, d5e3, d6e4, e3c4, c5c6, e5d4, c6d7, d4e3, d7c7, c4e5, e4d2, e5g6, d2b1, g6f4, b1c3, f4e2, c3b1, e2c1, c7b8, e3e2, b1d2, e2d3, b8c8, c1b3, c8b8, d3c2, b8c8, b3a1, c8d7, c2b2, d2b1, b2a2, d7e6, a1c2, e6f7, c2a1, f7e6, a2b3, e6d7, b3a2, d7c8, a1b3, b1d2, b3a1, c8d7, a1c2, d2b1, a2b3, d7c6, c2d4, c6d5, d4c2, b1d2, b3c3, d2b1, c3b2, b1d2, c2b4, d5e4, b4a2","[0.0037, 0.0042, 0.0047, 0.0039, 0.0018, 0.0031, 0.0028, 0.0027, 0.0039, 0.0033, 0.0044, 0.0025, 0.0031, 0.0035, 0.0034, 0.004, 0.0015, 0.0013, 0.0014, 0.0026, 0.0017, 0.0028, 0.0033, 0.0026, 0.002, 0.002, 0.0016, 0.0019, 0.0023, 0.0019, 0.0024, 0.0025, 0.0021, 0.0023, 0.0021, 0.0019, 0.0019, 0.0012, 0.0014, 0.0013, 0.0021, 0.0022, 0.0022, 0.0025, 0.0024, 0.0016, 0.0018, 0.0016, 0.0014, 0.001, 0.0011, 0.0015, 0.0009, 0.0013, 0.0014, 0.0013, 0.0007, 0.0012, 0.0005, 0.0007, 0.0012, 0.0004, 0.0003, 0.0003, 0.0, 0.001, 0.0, 0.0, 0.0, 0.0, 0.0, 0.0, 0.0, 0.0, 0.0, 0.0, 0.0, 0.0, 0.0, 0.0, 0.0, -0.0003, 0.0, -0.0004, 0.0, 0.0, -0.0012, 0.0, 0.0, 0.0, 0.0, 0.0, 0.0, 0.0, 0.0, 0.0, 0.0, 0.0, -0.0001, -0.0001, 0.0, 0.0, 0.0, 0.0, 0.0, 0.0, 0.0, 0.0, 0.0, 0.0, 0.0, 0.0, 0.0, 0.0, 0.0, 0.0, 0.0, 0.0, 0.0, 0.0, 0.0, 0.0, 0.0, 0.0, 0.0, 0.0, 0.0, 0.0, 0.0, 0.0, 0.0, 0.0, 0.0, 0.0, 0.0, 0.0, 0.0, 0.0, 0.0, 0.0, 0.0, 0.0, 0.0, 0.0, 0.0, 0.0, 0.0, 0.0, 0.0, 0.0, 0.0, 0.0, 0.0, 0.0, 0.0, 0.0, 0.0, 0.0, 0.0, 0.0, 0.0, 0.0, 0.0, 0.0, 0.0, 0.0, 0.0, 0.0, 0.0, 0.0, 0.0, 0.0, 0.0, 0.0, 0.0, 0.0, 0.0, 0.0, 0.0, 0.0, 0.0, 0.0, 0.0, 0.0, 0.0, 0.0, 0.0, 0.0, 0.0, 0.0, 0.0, 0.0, 0.0, 0.0, 0.0, 0.0, 0.0, 0.0, 0.0, 0.0, 0.0, 0.0, 0.0, 0.0, 0.0, 0.0, 0.0, 0.0, 0.0, 0.0, 0.0, 0.0, 0.0, 0.0, 0.0, 0.0, 0.0, 0.0, 0.0, 0.0, 0.0, 0.0, 0.0, 0.0, 0.0, 0.0, 0.0, 0.0, 0.0, 0.0, 0.0, 0.0, 0.0, 0.0, 0.0, 0.0, 0.0, 0.0, 0.0, 0.0, 0.0, 0.0, 0.0, 0.0, 0.0, 0.0, 0.0, 0.0, 0.0, 0.0, 0.0, 0.0, 0.0, 0.0, 0.0, 0.0, 0.0, 0.0, 0.0, 0.0, 0.0, 0.0, 0.0, 0.0, 0.0, 0.0, 0.0, 0.0, 0.0]","0, 0, 0, 0, -1, 0, 0, 3, 0, 0, 0, 0, 0, 0, 0, 0, 0, 0, 0, 0, 0, 0, 0, 0, 0, 0, -9, 0, -3, 0, 0, 0, 0, 0, -3, 0, 0, 0, 0, 0, 0, 0, 0, 5, 0, 0, 0, 0, -1, 0, 0, 0, 0, 0, 0, 0, 0, 0, 0, 0, 0, 0, 0, 0, 0, 1, 1, 1, 1, 1, 1, 1, 1, 1, 1, 1, 1, 1, 1, 2, 1, 1, 1, 1, 1, 1, 1, 1, 1, 1, 1, 1, 1, 1, 1, 1, 0, 1, 0, 0, 0, 1, 1, 6, 1, 1, 1, 1, 0, 1, 1, 2, 1, 1, 1, 1, 1, 1, 0, 0, 0, 0, 0, 0, 0, 0, 0, 0, 0, 0, 0, 0, 0, 0, 0, 0, 0, 0, 0, 0, 0, 0, 0, 0, 0, 0, 0, 0, 0, 0, 0, 0, 0, 0, 0, 0, 0, 0, 0, 0, 0, 0, 0, 0, 0, 0, 0, 0, 0, 0, 0, 0, 0, 0, 0, 0, 0, 0, 0, 0, 0, 0, 0, 0, 0, 0, 0, 0, 0, 0, 0, 0, 0, 0, 0, 0, 0, 0, 0, 0, 0, 0, 0, 0, 0, 0, 0, 0, 0, 0, 0, 0, 0, 0, 0, 0, 0, 0, 0, 0, 0, 0, 0, 0, 0, 0, 0, 0, 0, 0, 0, 0, 0, 0, 0, 0, 0, 0, 0, 0, 0, 0, 0, 0, 0, 0, 0, 0, 0, 0, 0, 0, 0, 0, 0, 0, 0, 0, 0, 0, 0, 0, 0, 0, 0, 0, 0, 0, 0",269
Draw,Draw,Stockfish,Stockfish,"e4d5, d8d5, b1c3, d5d8, g1f3, b8c6, f1b5, c8d7, e1g1, e7e6, f1e1, g8f6, b5c6, d7c6, f3e5, a8c8, b2b3, f8d6, c1b2, e8g8, e5c6, c8c6, c3e4, f6e4, e1e4, d6e7, d2d3, e7f6, b2f6, d8f6, g2g3, b7b6, e4f4, f6e5, a2a4, f8d8, f4e4, e5f6, e4f4, f6c3, f4c4, c3f6, c4f4, f6e5, f4e4, e5b2, a1b1, b2f6, e4f4, f6e7, d1f3, c6d6, b1e1, e7c7, e1e5, d6d5, e5d5, d8d5, f4c4, c7d8, h2h4, g7g6, f3e3, d8d6, c4e4, g8g7, e3e1, d5d4, e1e3, h7h6, e4e5, d4b4, a4a5, g7f6, e5e4, b4e4, e3e4, d6e5, e4a8, e5e1, g1g2, e1a5, a8h8, f6e7, h8h6, a5c3, h6g5, e7f8, g5f4, c3c2, f4b8, f8g7, b8e5, g7h7, e5c7, h7g7, c7e5, g7h7, e5c7, h7g7, c7e5, g7h7, e5c7, h7g7, c7e5, g7h7, e5f4, h7g7, f4e5","[0.0014, 0.0011, 0.0, 0.0007, 0.0007, 0.0008, 0.0003, 0.001, 0.0008, 0.0008, 0.0009, 0.0001, 0.0, -0.0002, 0.0, 0.0005, 0.0, -0.0004, -0.0003, 0.0, -0.0002, -0.0005, -0.001, 0.0, 0.0003, -0.0005, 0.0, 0.0, -0.001, 0.0, 0.0, 0.0, -0.0002, -0.0006, -0.0003, -0.0003, -0.0003, 0.0, 0.0, 0.0, 0.0, 0.0, 0.0, 0.0, 0.0, 0.0, 0.0, 0.0, 0.0, 0.0, 0.0, 0.0, 0.0, 0.0, 0.0, 0.0, 0.0, 0.0, 0.0, 0.0, 0.0, 0.0, 0.0, 0.0, 0.0, 0.0, 0.0, 0.0, 0.0, 0.0, 0.0, 0.0, 0.0, 0.0, 0.0, 0.0, 0.0, 0.0, 0.0, 0.0, 0.0, 0.0, 0.0, 0.0, 0.0, 0.0, 0.0, 0.0, 0.0, 0.0, 0.0, 0.0, 0.0, 0.0, 0.0, 0.0, 0.0, 0.0, 0.0, 0.0, 0.0, 0.0, 0.0, 0.0, 0.0, 0.0, 0.0, 0.0, 0.0]","1, 0, 0, 0, 0, 0, 0, 0, 0, 0, 0, 0, 3, 0, 0, 0, 0, 0, 0, 0, 3, 0, 0, -3, 0, 0, 0, 0, 3, 0, 0, 0, 0, 0, 0, 0, 0, 0, 0, 0, 0, 0, 0, 0, 0, 0, 0, 0, 0, 0, 0, 0, 0, 0, 0, 0, 5, 0, 0, 0, 0, 0, 0, 0, 0, 0, 0, 0, 0, 0, 0, 0, 0, 0, 0, -5, 0, 0, 0, 0, 0, -1, -1, -1, 0, 0, 0, 0, 0, -1, -1, -1, -1, -1, -1, -1, -1, -1, -1, -1, -1, -1, -1, -1, -1, -1, -1, -1, -1",109
Draw,Draw,Stockfish,Stockfish,"c4d5, g8f6, g1f3, c7c6, d5c6, b8c6, d2d4, e7e5, f3e5, f8b4, b1c3, c6e5, d4e5, d8d1, e1d1, f6g4, d1e1, g4e5, a2a3, b4c3, b2c3, e5c4, g2g3, e8g8, h2h4, h7h5, f1g2, f8e8, a1b1, c4d6, c1f4, c8f5, b1c1, d6e4, c3c4, a8c8, f2f3, e4c5, e1f2, c8c6, h1d1, f5e6, f4e3, c6c8, c1b1, e6c4, g2h3, c8c7, b1c1, b7b5, d1d6, c5b7, d6d7, c7d7, h3d7, e8d8, d7c6, b7a5, c6e4, a5b3, c1c3, a7a6, g3g4, h5g4, f3g4, b3d4, h4h5, d4e6, c3c1, f7f6, a3a4, e6g5, e4b7, d8d6, b7c8, d6c6, c8f5, c6d6, f5c8, d6c6, c8f5, c6d6, a4a5, g5f7, e3f4, d6d8, f5g6, d8d4, f2e3, d4d5, e3f3, d5d8, c1c2, d8d1, c2c3, g8f8, f3f2, f7h6, c3g3, c4e6, g4g5, h6g4, f2g2, f6g5, f4g5, d1d4, g3d3, d4d3, e2d3, e6f7, g6e4, f7h5, e4b7, g4e5, b7a6, h5e8, g5d2, f8e7, g2f2, e5d3, f2e3, d3e5, e3e2, e8c6, a6c8, e5d7, e2e3, e7d8, c8d7, d8d7, e3f4, d7e6, f4g5, c6e4, g5f4, e4c6, d2b4, e6f7, b4c3, b5b4, c3b4, g7g6, b4c3, g6g5, f4g5, c6h1, c3g7, h1g2, g7b2, g2f1, g5f4, f1e2, f4f5, e2d3, f5e5, d3a6, b2c3, a6f1, a5a6, f1a6, c3a1, a6b7, a1b2, f7g6, b2a1, b7a8, a1b2, a8b7, b2a1, g6f7, a1d4, b7a6, d4c3, f7g6, c3a1, g6g5, a1b2, a6b5, b2a1, g5g6, a1b2, b5d7, b2a1, d7c6, a1c3, c6e4, c3b4, g6f7, b4e1, e4c6, e1f2, c6a8, f2e1, a8d5, e1d2, d5h1, d2c1, h1c6, c1b2, c6h1, b2c3, h1d5, e5d4, d5g2, c3a1, g2c6, d4e3, c6a8, a1b2, a8h1, b2a1, h1g2, a1h8, f7e6, h8a1, e6f5, a1b2, g2a8, b2a1, a8h1, a1g7, h1g2, g7a1, f5e6, a1b2, e6f5, b2a1, f5e6, a1g7, g2a8, g7h8, a8h1, h8c3, e6f5, c3a1, h1g2, a1b2, g2b7, b2g7, b7c6, g7e5, c6h1, e5g7, h1b7, g7d4, b7a8, d4a1, f5e6, a1b2, e6d6, b2e5, d6d7, e5a1, a8e4, a1b2, d7c8, e3e4","[0.0073, 0.0063, 0.0065, 0.0064, 0.0054, 0.0057, 0.0071, 0.0057, 0.0068, 0.0055, 0.007, 0.0067, 0.007, 0.0076, 0.0065, 0.0072, 0.0064, 0.008, 0.0079, 0.0071, 0.0063, 0.0055, 0.0052, 0.0063, 0.006, 0.005, 0.0056, 0.0058, 0.0064, 0.0059, 0.0064, 0.0062, 0.0058, 0.0053, 0.005, 0.005, 0.0049, 0.0063, 0.0053, 0.0065, 0.0049, 0.0052, 0.0056, 0.0037, 0.0056, 0.0062, 0.0047, 0.0042, 0.004, 0.0035, 0.0032, 0.0044, 0.0042, 0.0049, 0.0043, 0.0041, 0.0029, 0.0038, 0.0031, 0.003, 0.003, 0.0037, 0.004, 0.0041, 0.0028, 0.0028, 0.0033, 0.0024, 0.0035, 0.0035, 0.0043, 0.0034, 0.0034, 0.0031, 0.0035, 0.003, 0.0026, 0.0023, 0.0027, 0.0031, 0.0027, 0.0024, 0.0024, 0.0028, 0.0023, 0.0025, 0.0032, 0.0028, 0.0025, 0.0031, 0.0034, 0.0031, 0.003, 0.0015, 0.0017, 0.0013, 0.001, 0.0009, 0.0013, 0.0016, 0.0021, 0.0014, 0.0011, 0.0013, 0.0017, 0.0014, 0.001, 0.0006, 0.0006, 0.0004, 0.0007, 0.0006, 0.0003, 0.0002, 0.0003, 0.0005, 0.0, 0.0, 0.0, 0.0, 0.0, 0.0, 0.0, 0.0, 0.0, 0.0, 0.0, 0.0, 0.0, 0.0, 0.0, 0.0, 0.0, 0.0, 0.0, 0.0, 0.0, 0.0, 0.0, 0.0, 0.0, 0.0, 0.0, 0.0, 0.0, 0.0, 0.0, 0.0, 0.0, 0.0, 0.0, 0.0, 0.0, 0.0, 0.0, 0.0, 0.0, 0.0, 0.0, 0.0, 0.0, 0.0, 0.0, 0.0, 0.0, 0.0, 0.0, 0.0, 0.0, 0.0, 0.0, 0.0, 0.0, 0.0, 0.0, 0.0, 0.0, 0.0, 0.0, 0.0, 0.0, 0.0, 0.0, 0.0, 0.0, 0.0, 0.0, 0.0, 0.0, 0.0, 0.0, 0.0, 0.0, 0.0, 0.0, 0.0, 0.0, 0.0, 0.0, 0.0, 0.0, 0.0, 0.0, 0.0, 0.0, 0.0, 0.0, 0.0, 0.0, 0.0, 0.0, 0.0, 0.0, 0.0, 0.0, 0.0, 0.0, 0.0, 0.0, 0.0, 0.0, 0.0, 0.0, 0.0, 0.0, 0.0, 0.0, 0.0, 0.0, 0.0, 0.0, 0.0, 0.0, 0.0, 0.0, 0.0, 0.0, 0.0, 0.0, 0.0, 0.0, 0.0, 0.0, 0.0, 0.0, 0.0, 0.0, 0.0, 0.0, 0.0, 0.0, 0.0, 0.0, 0.0, 0.0, 0.0, 0.0]","1, 1, 1, 1, 2, 1, 1, 1, 2, 2, 2, -1, 2, -7, 2, 2, 2, 1, 1, -2, 1, 1, 1, 1, 1, 1, 1, 1, 1, 1, 1, 1, 1, 1, 1, 1, 1, 1, 1, 1, 1, 1, 1, 1, 1, 0, 0, 0, 0, 0, 0, 0, 0, -5, 0, 0, 0, 0, 0, 0, 0, 0, 0, -1, 0, 0, 0, 0, 0, 0, 0, 0, 0, 0, 0, 0, 0, 0, 0, 0, 0, 0, 0, 0, 0, 0, 0, 0, 0, 0, 0, 0, 0, 0, 0, 0, 0, 0, 0, 0, 0, 0, 0, -1, 0, 0, 0, -5, 0, 0, 0, -1, -1, -1, 0, 0, 0, 0, 0, -1, -1, -1, -1, -1, -1, -1, -1, -1, 2, -1, -1, -1, -1, -1, -1, -1, -1, -1, -1, -1, 0, 0, 0, 0, 1, 1, 1, 1, 1, 1, 1, 1, 1, 1, 1, 1, 1, 1, 1, 0, 0, 0, 0, 0, 0, 0, 0, 0, 0, 0, 0, 0, 0, 0, 0, 0, 0, 0, 0, 0, 0, 0, 0, 0, 0, 0, 0, 0, 0, 0, 0, 0, 0, 0, 0, 0, 0, 0, 0, 0, 0, 0, 0, 0, 0, 0, 0, 0, 0, 0, 0, 0, 0, 0, 0, 0, 0, 0, 0, 0, 0, 0, 0, 0, 0, 0, 0, 0, 0, 0, 0, 0, 0, 0, 0, 0, 0, 0, 0, 0, 0, 0, 0, 0, 0, 0, 0, 0, 0, 0, 0, 0, 0, 0, 0, 0, 3",257
Black,White,Stockfish,Stockfish,"h2h4, g8h6, d2d3, d7d5, c2c3, d5e4, d3e4, e7e5, c3d4, e5d4, c1g5, d8d7, g1f3, h6g4, g5f4, f8b4, b1d2, e8g8, a1c1, f8e8, f1d3, g4e3, f2e3, d4e3, d1e2, e3d2, f4d2, b4d2, e2d2, b8c6, e1g1, h7h6, d2e3, d7g4, e4e5, c8d7, a2a3, g4g3, c1e1, a8d8, d3h7, g8h8, e3c3, d7h3, f1f2, f7f5, e5f6, e8e1, f3e1, g3c3, b2c3, h8h7, g2h3, c6e5, f2f5, e5f7, f6g7, h7g7, e1f3, d8e8, f5c5, c7c6, a3a4, f7d6, h4h5, e8e4, a4a5, e4c4, c5e5, g7f6, e5e3, d6f5, e3d3, f6e6, f3d2, c4c5, d2b3, c5d5, d3f3, f5d6, g1g2, d5h5, f3f4, b7b5, a5b6, a7b6, b3c1, c6c5, c1d3, h5d5, d3f2, b6b5, f4g4, d5f5, g4g6, f5f6, g6g4, h6h5, g4g8, e6d5, g8h8, f6f5, h8d8, h5h4, f2g4, f5f4, g4e3, d5e4, e3g4, d6c4, g4f2, e4e3, d8e8, e3d2, f2e4, d2d3, e4c5, d3c3, e8d8, b5b4, g2g1, c4e5, d8d5, e5f3, g1h1, c3c4, d5h5, f3d2, h1g1, b4b3, c5a4, c4d3, a4b6, b3b2, h5d5, d3e2, d5b5, b2b1q, b5b1, d2b1, b6d5, f4f3, d5f4, f3f4, g1g2, b1d2, g2g1, f4c4, g1h2, e2f2, h2h1, c4c1, h1h2, d2f3","[0.0035, 0.0192, 0.0135, 0.0094, 0.0064, 0.0005, -0.0104, -0.0085, -0.0095, -0.0109, -0.0095, -0.011, -0.0117, -0.0126, -0.0111, -0.013, -0.0111, -0.0108, -0.0096, -0.0106, -0.0121, -0.0114, -0.0108, -0.0113, -0.0114, -0.0118, -0.0119, -0.0107, -0.0113, -0.0114, -0.0108, -0.0103, -0.0086, -0.0097, -0.0101, -0.0096, -0.0095, -0.0096, -0.0089, -0.0109, -0.0098, -0.0097, -0.0109, -0.0115, -0.0105, -0.0107, -0.0095, -0.0109, -0.0096, -0.009, -0.0106, -0.0106, -0.01, -0.0113, -0.0109, -0.0112, -0.0102, -0.0121, -0.0091, -0.0107, -0.0104, -0.0102, -0.0096, -0.0121, -0.0135, -0.0125, -0.0139, -0.0131, -0.0147, -0.0143, -0.014, -0.0146, -0.0163, -0.0175, -0.0167, -0.0135, -0.018, -0.0176, -0.0181, -0.02, -0.0171, -0.018, -0.0189, -0.02, -0.0203, -0.0206, -0.02, -0.0204, -0.0214, -0.0196, -0.02, -0.021, -0.0204, -0.0225, -0.0247, -0.0239, -0.024, -0.0235, -0.0239, -0.0207, -0.0251, -0.0267, -0.0251, -0.0281, -0.0287, -0.0281, -0.0286, -0.0289, -0.0289, -0.0287, -0.0287, -0.0305, -0.0306, -0.0303, -0.0315, -0.0287, -0.0322, -0.0312, -0.0328, -0.0325, -0.0345, -0.0354, -0.0356, -0.0359, -0.0378, -0.0392, -0.0408, -0.0448, -0.0449, -0.046, -0.0521, -0.0514, -0.3401, -0.999, -0.999, -0.9991, -0.9991, -0.9992, -0.9992, -0.9993, -0.9993, -0.9994, -0.9994, -0.9995, -0.9995, -0.9996, -0.9996, -0.9997, -0.9997, -0.9998, -0.9998, -0.9999, -0.9999, -1.0]","-3, -3, -3, -3, -3, -4, -3, -3, 0, -1, -1, -1, -1, -1, -1, -1, -1, -1, -1, -1, -1, -1, 2, 1, 1, -2, -1, -4, -1, -1, -1, -1, -1, -1, -1, -1, -1, -1, -1, -1, -1, -1, -1, -1, -1, -1, 0, -5, 0, -9, 0, -3, 0, 0, 0, 0, 1, 0, 0, 0, 0, 0, 0, 0, 0, 0, 0, 0, 0, 0, 0, 0, 0, 0, 0, 0, 0, 0, 0, 0, 0, -1, -1, -1, 0, -1, -1, -1, -1, -1, -1, -1, -1, -1, -1, -1, -1, -1, -1, -1, -1, -1, -1, -1, -1, -1, -1, -1, -1, -1, -1, -1, -1, -1, -1, -1, 0, -1, -1, -1, -1, -1, -1, -1, -1, -1, -1, -1, -1, -1, -1, -1, -1, -1, -1, -1, -1, -9, 0, -5, -5, -5, -5, -8, -8, -8, -8, -8, -8, -8, -8, -8, -8, -8",154
