winner,loser,white_pieces,black_pieces,moves,evaluations,material_advantage,move_count
Draw,Draw,Stockfish,Stockfish,"e7e5, e2e4, g8f6, b1c3, f8b4, g1f3, e8g8, f3e5, f8e8, e5d3, f6e4, f1e2, b4f8, c3e4, e8e4, e1g1, d7d5, e2f3, e4e8, d3f4, c7c6, d2d4, b8d7, c2c3, a7a5, a2a4, d7f6, f4d3, h7h6, c1f4, c8f5, f4e5, f6e4, f1e1, d8b6, f3g4, f5h7, h2h4, e8e7, d1f3, e4d2, f3f4, d2c4, g4f5, h7f5, f4f5, a8e8, h4h5, b6d8, b2b3, c4d2, e1e2, d2e4, e2c2, c6c5, a1d1, d8b6, c2b2, b6d8, d1c1, b7b6, e5f4, e7e6, b2c2, e6f6, f5g4, f6e6, g4f3, e4g5, f3g4, d8c8, g4d1, g5e4, c3c4, d5c4, c2c4, c8d8, d4c5, e4c5, d3c5, f8c5, d1d8, e8d8, g1f1, d8d3, c4c3, d3d5, g2g4, g8h7, c3c4, f7f5, g4g5, h6g5, f4g5, e6e4, c4e4, f5e4, g5e3, c5e3, f2e3, d5h5, c1c6, h5h6, c6c4, h6h1, f1g2, h1b1, c4c3, g7g5, g2g3, b1g1, g3f2, g1b1, f2g3, h7g6, c3c6, g6h5, c6b6, b1g1, g3f2, g1b1, f2g3, b1b2, b6e6, b2b3, e6e4, b3b4, e4b4, a5b4, a4a5, b4b3, a5a6, b3b2, a6a7, b2b1q, a7a8q, b1g1, a8g2, g1e3, g3h2, e3f4, g2g3, f4g3, h2g3, g5g4, g3g2, h5h4, g2h2, g4g3, h2g1, h4h3, g1h1, h3g4, h1g2, g4f4, g2g1, f4e4, g1g2, e4f4, g2g1, f4f3, g1h1, f3g4, h1g1, g4f3, g1f1, f3g4, f1g2, g4h4, g2g1, h4g5, g1g2, g5g4, g2g1, g4f3, g1f1, g3g2, f1g1, f3e2, g1g2","[-0.0041, -0.0052, -0.0033, -0.0041, -0.0048, -0.0029, -0.0031, -0.0029, -0.0026, -0.0023, -0.0028, -0.0033, -0.0024, -0.0023, -0.0025, -0.0021, -0.0024, -0.0024, -0.0027, -0.0026, -0.0028, -0.003, -0.0028, -0.0021, -0.0025, -0.0032, -0.0035, -0.0029, -0.0032, -0.0034, -0.0037, -0.0027, -0.0032, -0.0032, -0.0033, -0.0029, -0.003, -0.003, -0.0028, -0.0028, -0.0026, -0.0018, -0.002, -0.0013, -0.0014, -0.0007, -0.0015, -0.0005, -0.0015, -0.0012, -0.0028, -0.0023, -0.0035, -0.0012, -0.0023, -0.0032, -0.0053, -0.0066, -0.0022, -0.0022, -0.0038, -0.003, -0.0051, -0.0042, -0.0023, -0.0035, -0.005, -0.0043, -0.0057, -0.0044, -0.0057, -0.0074, -0.0058, -0.0037, -0.0037, -0.0023, -0.0026, -0.0049, -0.0073, -0.0048, -0.0026, -0.0024, -0.0017, -0.0019, -0.0025, -0.0021, -0.0015, -0.0019, -0.0018, -0.0013, -0.0012, -0.0019, -0.0013, -0.0006, -0.0004, -0.0003, -0.0007, -0.0008, -0.0002, -0.0002, -0.0002, -0.0002, -0.0003, -0.0004, -0.0005, -0.0006, -0.0004, -0.0003, -0.0002, -0.0002, -0.0002, -0.0001, -0.0003, -0.0002, 0.0, 0.0, 0.0, 0.0, 0.0, 0.0, 0.0, 0.0, 0.0, 0.0, 0.0, 0.0, 0.0, 0.0, 0.0, 0.0, 0.0, 0.0, 0.0, 0.0, 0.0, 0.0, 0.0, 0.0, 0.0, 0.0, 0.0, 0.0, 0.0, 0.0, 0.0, 0.0, 0.0, 0.0, 0.0, 0.0, 0.0, 0.0, 0.0, 0.0, 0.0, 0.0, 0.0, 0.0, 0.0, 0.0, 0.0, 0.0, 0.0, 0.0, 0.0, 0.0, 0.0, 0.0, 0.0, 0.0, 0.0, 0.0, 0.0, 0.0, 0.0, 0.0, 0.0, 0.0, 0.0, 0.0]","0, 0, 0, 0, 0, 0, 0, 1, 1, 1, 0, 0, 0, 3, 0, 0, 0, 0, 0, 0, 0, 0, 0, 0, 0, 0, 0, 0, 0, 0, 0, 0, 0, 0, 0, 0, 0, 0, 0, 0, 0, 0, 0, 0, -3, 0, 0, 0, 0, 0, 0, 0, 0, 0, 0, 0, 0, 0, 0, 0, 0, 0, 0, 0, 0, 0, 0, 0, 0, 0, 0, 0, 0, 0, -1, 0, 0, 1, 0, 3, 0, 9, 0, 0, 0, 0, 0, 0, 0, 0, 0, 0, -1, 0, 0, 5, 0, 0, -3, 0, -1, -1, -1, -1, -1, -1, -1, -1, -1, -1, -1, -1, -1, -1, -1, -1, -1, 0, 0, 0, 0, 0, 0, 0, -1, 0, 0, 5, 0, 0, 0, 0, 0, 0, -8, 0, 0, 0, -1, -1, -1, -1, -10, -1, -1, -1, -1, -1, -1, -1, -1, -1, -1, -1, -1, -1, -1, -1, -1, -1, -1, -1, -1, -1, -1, -1, -1, -1, -1, -1, -1, -1, -1, -1, -1, -1, -1, -1, -1, 0",180
Draw,Draw,Stockfish,Stockfish,"d2d4, d7d5, b1c3, g8f6, c1g5, d5e4, c3e4, f8e7, g5f6, g7f6, g1f3, f6f5, e4c3, a7a6, g2g3, b7b5, f1g2, c8b7, e1g1, e8g8, d1e2, c7c5, d4c5, b5b4, c3a4, d8a5, b2b3, b8d7, f3e5, b7g2, g1g2, d7c5, e5c6, a5c7, c6e7, c7e7, a4c5, e7c5, a2a3, b4a3, e2d2, f8c8, d2g5, g8h8, g5f6, h8g8, f6g5, g8h8, g5f6, h8g8, a1a2, c5d5, f2f3, d5d2, f1f2, d2c3, f6g5, g8h8, g5e7, h8g7, e7g5, g7h8, g5e7, h8g7, e7g5, g7h8, g5e7, h8g7, e7g5, g7h8, g5e7, h8g7, e7g5, g7h8","[0.0045, 0.0037, 0.0034, 0.0034, 0.0034, 0.0032, 0.003, 0.0032, 0.0041, 0.0027, 0.0034, 0.0046, 0.0029, 0.0028, 0.003, 0.0024, 0.0031, 0.003, 0.0017, 0.0011, 0.0017, 0.0022, 0.0017, 0.0021, 0.0004, 0.0, 0.0, 0.0, 0.0, 0.0, 0.0, 0.0, 0.0, 0.0, 0.0, 0.0, 0.0, 0.0, 0.0, 0.0, 0.0, 0.0, 0.0, 0.0, 0.0, 0.0, 0.0, 0.0, 0.0, 0.0, 0.0, 0.0, 0.0, 0.0, 0.0, 0.0, 0.0, 0.0, 0.0, 0.0, 0.0, 0.0, 0.0, 0.0, 0.0, 0.0, 0.0, 0.0, 0.0, 0.0, 0.0, 0.0, 0.0, 0.0]","0, 0, 0, 0, 0, -1, 0, 0, 3, 0, 0, 0, 0, 0, 0, 0, 0, 0, 0, 0, 0, 0, 1, 1, 1, 1, 1, 1, 1, -2, 1, 0, 0, 0, 3, 0, 3, 0, 0, -1, -1, -1, -1, -1, -1, -1, -1, -1, -1, -1, -1, -1, -1, -1, -1, -1, -1, -1, -1, -1, -1, -1, -1, -1, -1, -1, -1, -1, -1, -1, -1, -1, -1, -1",74
Black,White,Stockfish,Stockfish,"c7c5, e2e3, g8f6, f1e2, f8e7, b2b3, e8g8, c1b2, c5d4, e3d4, b7b5, e2d3, d8b6, a2a3, b8c6, b1d2, a7a5, c2c3, a5a4, b3b4, e7d6, e1g1, f8e8, f1e1, e6e5, c3c4, d5c4, d2e4, d6f8, e4f6, g7f6, d3b1, c8g4, d1c2, e5e4, d4d5, c6e7, e1e4, g4f5, e4g4, g8h8, f3g5, e7g6, g4e4, f5e4, g5e4, a8d8, c2d2, f8g7, b1c2, f6f5, b2g7, h8g7, e4c3, e8e5, a1d1, g6e7, d2g5, g7h8, g5f4, f7f6, g2g4, e7d5, c3d5, d8d5, d1d5, e5d5, c2f5, d5e5, g1g2, b6c6, g2h3, c6d5, h3h4, h8g7, f4g3, e5e7, h4h3, d5d2, h3g2, c4c3, g3h4, h7h6, h4h5, d2g5, h5h3, c3c2, f5c2, g5d5, h3f3, d5f3, g2f3, e7c7, c2d3, c7c3, f3e2, c3a3, d3b5, a3a2, e2e3, a4a3, b5c4, a2c2, c4d5, c2b2, f2f4, b2b4, h2h3, b4b2, h3h4, a3a2, d5a2, b2a2, e3d3, f6f5, g4f5, a2a4, d3e2, h6h5, f5f6, g7f6, e2f3, f6f5, f3e2, a4f4, e2d1, f4h4, d1c2, h4e4, c2b1, h5h4, b1c1, e4e2, c1d1, e2a2, d1c1, h4h3, c1b1, a2f2, b1a1, h3h2, a1b1, h2h1q","[-0.0018, -0.0015, -0.0022, -0.0027, -0.0021, -0.0008, -0.0003, -0.0022, -0.0013, -0.0018, -0.0025, -0.001, -0.002, -0.0014, -0.0028, -0.0017, -0.0012, -0.0007, 0.0, -0.0008, -0.0001, -0.0009, -0.0006, 0.0, -0.0012, -0.0002, 0.0007, -0.0017, -0.0018, -0.0019, -0.0061, -0.006, -0.0071, -0.007, -0.009, -0.009, -0.0089, -0.0156, -0.0158, -0.0164, -0.0164, -0.0194, -0.0175, -0.0185, -0.0196, -0.02, -0.0203, -0.0186, -0.02, -0.0203, -0.0198, -0.0195, -0.0195, -0.0214, -0.0207, -0.0214, -0.0237, -0.0237, -0.0264, -0.0276, -0.0294, -0.0287, -0.0327, -0.0303, -0.035, -0.0353, -0.0367, -0.0357, -0.0352, -0.0404, -0.0439, -0.0409, -0.0467, -0.0478, -0.0488, -0.0471, -0.0514, -0.0526, -0.0507, -0.0531, -0.0532, -0.0526, -0.0548, -0.0552, -0.0554, -0.0543, -0.0572, -0.0556, -0.0569, -0.0583, -0.0561, -0.0561, -0.0592, -0.0589, -0.0605, -0.06, -0.0604, -0.0598, -0.0609, -0.0607, -0.061, -0.061, -0.0599, -0.061, -0.0624, -0.0625, -0.0636, -0.0659, -0.0669, -0.0681, -0.0711, -0.073, -0.0741, -0.0786, -0.0844, -0.0966, -0.3943, -0.9983, -0.9984, -0.9987, -0.9988, -0.9988, -0.9989, -0.9989, -0.999, -0.9991, -0.9992, -0.9992, -0.9993, -0.9993, -0.9994, -0.9994, -0.9995, -0.9995, -0.9996, -0.9996, -0.9997, -0.9997, -0.9998, -0.9998, -0.9999, -0.9999, -1.0]","0, 0, 0, 0, 0, 0, 0, 0, -1, 0, 0, 0, 0, 0, 0, 0, 0, 0, 0, 0, 0, 0, 0, 0, 0, 0, -1, -1, -1, 2, -1, -1, -1, -1, -1, -1, -1, 0, 0, 0, 0, 0, 0, 0, -5, -2, -2, -2, -2, -2, -2, 1, -2, -2, -2, -2, -2, -2, -2, -2, -2, -2, -3, 0, -3, 2, -3, -2, -2, -2, -2, -2, -2, -2, -2, -2, -2, -2, -2, -2, -2, -2, -2, -2, -2, -2, -2, -1, -1, -1, -10, -1, -1, -1, -1, -1, -2, -1, -1, -1, -1, -1, -1, -1, -1, -1, -2, -2, -2, -2, -2, -1, -4, -4, -4, -3, -3, -3, -3, -3, -4, -4, -4, -4, -5, -5, -6, -6, -6, -6, -6, -6, -6, -6, -6, -6, -6, -6, -6, -6, -6, -6, -14",143
Draw,Draw,Stockfish,Stockfish,"c4d5, c7c6, d5c6, b8c6, g1f3, e7e5, b1c3, g8f6, g2g3, h7h6, d2d3, f8c5, f1g2, d8e7, e1g1, e8g8, c3a4, c5d4, c1d2, f8d8, f3d4, c6d4, d2e3, c8d7, a4c3, d7c6, g2c6, d4c6, f2f3, c6d4, d1d2, e7d7, g1g2, a7a5, b2b3, b7b5, f1c1, d7e8, d2b2, b5b4, c3a4, f6d5, e3f2, e8e7, c1c4, e7g5, a1e1, d8d6, h2h4, g5g6, e2e3, d6f6, e3d4, d5f4, g2h2, f4d3, b2e2, d3e1, f2e1, e5d4, c4d4, a8c8, d4d2, f6e6, e2d1, e6c6, e1f2, c6c1, d1e2, c8c2, h2g2, g8h7, g3g4, h6h5, g2g3, h5g4, f3g4, c2d2, e2d2, g6c6, d2d3, h7g8, d3d8, g8h7, d8d4, c1c2, a4c5, c2a2, c5e4, f7f6, h4h5, c6e6, d4d3, h7h8, f2e3, a2b2, d3d8, h8h7, d8d3, h7h8, e4d2, a5a4, b3a4, b2a2, d3d8, h8h7, d8d3, h7h8, d2f3, e6e8, e3d2, a2a3, d3c4, e8b8, d2f4, b8b6, c4c8, h8h7, c8f5, h7h8, f5c8, h8h7, g4g5, f6g5, c8f5, h7h8, f5c8, h8h7, c8f5, h7h8, f5f8, h8h7, f8f5, h7h8, f4g5, b6g1, g3f4, g1e3, f4g4, e3e2, f5f8, h8h7, f8f5, h7h8, f5c8, h8h7, c8f5, h7h8, f5c8, h8h7, c8f5, h7h8, f5f8, h8h7, f8f5, h7h8","[0.0067, 0.0064, 0.0054, 0.0064, 0.0063, 0.0068, 0.0064, 0.0068, 0.0073, 0.006, 0.0064, 0.006, 0.0068, 0.005, 0.0057, 0.0061, 0.0062, 0.0052, 0.0061, 0.0058, 0.0062, 0.0059, 0.0064, 0.0056, 0.0066, 0.0059, 0.0064, 0.0061, 0.0068, 0.0062, 0.0058, 0.0054, 0.0056, 0.0074, 0.0053, 0.0056, 0.0052, 0.0063, 0.007, 0.0067, 0.0064, 0.0063, 0.0084, 0.0075, 0.0069, 0.0072, 0.0073, 0.0104, 0.0081, 0.0041, 0.0082, 0.0034, 0.0031, 0.0016, 0.0027, 0.0023, 0.0011, 0.0013, 0.0031, 0.0025, 0.0004, 0.0, 0.0, 0.0021, 0.0032, 0.0026, 0.0025, 0.003, 0.0025, 0.002, 0.0023, 0.0021, 0.0017, 0.0027, 0.0016, 0.0033, 0.0029, 0.002, 0.0015, 0.0012, 0.0013, 0.0026, 0.0014, 0.0015, 0.0016, 0.0009, 0.0011, 0.0019, 0.0023, 0.0022, 0.0021, 0.0015, 0.0012, 0.0013, 0.0007, 0.0002, 0.0002, 0.0, 0.0, 0.0, 0.0, 0.0, 0.0, 0.0, 0.0, 0.0001, 0.0, 0.0, 0.0, 0.0, 0.0, 0.0, 0.0, 0.0, 0.0, 0.0, 0.0, 0.0, 0.0, 0.0, 0.0, 0.0, 0.0, 0.0, 0.0, 0.0, 0.0, 0.0, 0.0, 0.0, 0.0, 0.0, 0.0, 0.0, 0.0, 0.0, 0.0, 0.0, 0.0, 0.0, 0.0, 0.0, 0.0, 0.0, 0.0, 0.0, 0.0, 0.0, 0.0, 0.0, 0.0, 0.0, 0.0, 0.0, 0.0, 0.0]","1, 1, 2, 1, 1, 1, 1, 1, 1, 1, 1, 1, 1, 1, 1, 1, 1, 1, 1, 1, 4, 1, 1, 1, 1, 1, 4, 1, 1, 1, 1, 1, 1, 1, 1, 1, 1, 1, 1, 1, 1, 1, 1, 1, 1, 1, 1, 1, 1, 1, 1, 1, 4, 4, 4, 3, 3, -2, 1, 0, 1, 1, 1, 1, 1, 1, 1, 1, 1, 1, 1, 1, 1, 1, 1, 0, 1, -4, 1, 1, 1, 1, 1, 1, 1, 1, 1, 0, 0, 0, 0, 0, 0, 0, 0, 0, 0, 0, 0, 0, 0, 0, 1, 1, 1, 1, 1, 1, 1, 1, 1, 1, 1, 1, 1, 1, 1, 1, 1, 1, 1, 1, 1, 0, 0, 0, 0, 0, 0, 0, 0, 0, 0, 0, 1, 1, 1, 1, 1, 1, 1, 1, 1, 1, 1, 1, 1, 1, 1, 1, 1, 1, 1, 1, 1, 1",156
Draw,Draw,Stockfish,Stockfish,"e7e5, g1f3, b8c6, f1b5, a7a6, b5a4, g8f6, e1g1, f6e4, d2d4, b7b5, a4b3, d7d5, d4e5, c8e6, c1e3, f8e7, c2c3, d8d7, b1d2, e4d2, d1d2, c6a5, b3c2, a5c4, d2e2, c4b2, f3d4, b2c4, a2a4, e8g8, e2d3, g7g6, e3h6, f8e8, d3g3, e7f8, h6f8, e8f8, h2h4, c7c5, d4e6, d7e6, f1e1, b5b4, c3b4, c5b4, h4h5, a8c8, c2d1, c4d6, d1b3, d6f5, g3f4, a6a5, a1d1, f8d8, f4g5, h7h6, g5d2, c8c5, h5g6, e6g6, b3c2, d8c8, c2b1, g6e6, d2d3, f5h4, d3h7, g8f8, b1d3, c8c6, h7h8, f8e7, h8g7, c5c3, f2f4, h4f5, g7g4, c3d3, d1d3, d5d4, g4e2, c6c3, d3c3, d4c3, e2b5, e6d7, b5a5, d7d4, g1h1, d4f4, a5c5, e7e8, c5c8, e8e7, c8c5, e7e8, c5c8, e8e7, c8c5, e7e8, c5c8, e8e7, c8c5, e7e8, c5c8, e8e7, c8c5","[0.0038, 0.0029, 0.003, 0.0031, 0.0033, 0.0035, 0.0032, 0.0038, 0.0046, 0.003, 0.0029, 0.0027, 0.0023, 0.0026, 0.0027, 0.0028, 0.004, 0.004, 0.0026, 0.0032, 0.0041, 0.0025, 0.0021, -0.0012, -0.003, -0.0028, -0.0026, -0.0019, -0.0015, -0.0014, -0.0001, 0.0, -0.0018, -0.0026, -0.0015, -0.0017, -0.0014, -0.002, -0.0023, -0.0036, -0.0045, -0.0046, -0.0039, -0.0055, -0.0037, -0.0048, -0.0064, -0.0053, -0.0043, -0.0036, -0.0037, -0.0018, -0.0014, -0.0016, -0.0016, -0.0034, -0.004, -0.0039, -0.0014, -0.0025, -0.0032, -0.0018, -0.0007, -0.0008, -0.001, -0.0005, -0.0003, -0.0001, 0.0, 0.0, 0.0, 0.0, 0.0, 0.0, 0.0, 0.0, 0.0, 0.0, 0.0, 0.0, 0.0, 0.0, 0.0, 0.0, 0.0, 0.0, 0.0, 0.0, 0.0, 0.0, 0.0, 0.0, 0.0, 0.0, 0.0, 0.0, 0.0, 0.0, 0.0, 0.0, 0.0, 0.0, 0.0, 0.0, 0.0, 0.0, 0.0, 0.0, 0.0, 0.0]","0, 0, 0, 0, 0, 0, 0, 0, -1, -1, -1, -1, -1, 0, 0, 0, 0, 0, 0, 0, -3, 0, 0, 0, 0, 0, -1, -1, -1, -1, -1, -1, -1, -1, -1, -1, -1, 2, -1, -1, -1, 2, -1, -1, -1, 0, -1, -1, -1, -1, -1, -1, -1, -1, -1, -1, -1, -1, -1, -1, -1, 0, -1, -1, -1, -1, -1, -1, -1, -1, -1, -1, -1, -1, -1, -1, -1, -1, -1, -1, -4, 1, 1, 1, 1, 6, 1, 1, 1, 2, 2, 2, 1, 1, 1, 1, 1, 1, 1, 1, 1, 1, 1, 1, 1, 1, 1, 1, 1, 1",110
Draw,Draw,Stockfish,Stockfish,"c2c3, b8c6, d2d3, e7e6, g2g3, d7d5, c3d4, d5e4, b1c3, c6d4, d3e4, g8e7, g1f3, d4f3, d1f3, e7c6, c1e3, f8b4, f1b5, e8g8, a1d1, d8e7, e1g1, c8d7, e3f4, b4c5, f3d3, d7e8, e4e5, a7a6, b5a4, a8d8, d3e4, d8d1, f1d1, f7f6, e5f6, e7f6, h2h4, c5d6, a4b3, d6f4, e4f4, f6f4, g3f4, f8f4, b3e6, g8f8, e6c8, e8h5, d1d7, h5f3, g1h2, f4h4, h2g3, h4g4, g3f3, c6e5, f3e3, e5d7, c8d7, g4g6, d7f5, g6b6, c3a4, b6b4, b2b3, h7h5, f5c8, h5h4, f2f4, a6a5, a4c5, f8e7, c5b7, h4h3, e3f2, a5a4, b7a5, b4f4, f2g3, h3h2, g3h2, f4f2, h2g3, f2a2, b3a4, a2a4, a5c6, e7d6, c8b7, a4c4, c6d8, d6e7, d8c6, e7d6, c6d8, c7c5, d8f7, d6e6, f7g5, e6f5, g5f3, c4g4, g3f2, g4b4, b7d5, f5f4, f3g1, f4e5, d5f7, b4b7, f7g6, c5c4, g1e2, b7b8, g6h7, b8h8, h7b1, h8h2, f2f3, h2h6, f3e3, h6h3, e3f2, e5d6, b1f5, h3h2, f2e3, d6e5, f5g6, h2h3, e3f2, h3h6, g6b1, h6a6, f2f3, a6f6, f3e3, f6a6, e3f3, a6a1, b1g6, a1a3, f3f2, a3a6, g6c2, a6f6, f2e3, f6h6, e3f3, h6f6, f3e3, f6h6, c2b1, h6h3, e3f2, h3a3, b1g6, e5d5, g6b1, d5c5, e2g3, a3a1, b1e4, c5d4, e4h7, a1a2, f2f3, d4c3, g3f1, c3d4, f1g3, d4e5, g3e2, a2a3, f3f2, e5d5, h7b1, d5c5, e2g3, a3b3, b1e4, c5d4, e4h7, b3b2, g3e2, d4c5, h7e4, b2b8, f2e3, b8e8, e2c3, e8d8, c3e2, d8e8, e2c3, e8h8, e4g6, h8h3, e3d2, h3h2, d2e3, h2h3, e3d2, c5b4, c3d5, b4b3, d5e3, c4c3, d2e2, h3h2, e2f3, h2d2, g6f7, b3b2, e3c4, b2c2, f7g6, c2c1, f3e3, d2d8, e3e4, c1c2, e4f4, c2b3, c4e3, b3b2, e3c4, b2a2, c4e3, d8d6, g6e4, d6d8, e4g6, d8d6, g6e4, d6d7, e4g6, d7d8, f4e5, a2a3, e5f4, a3b2, e3c4, b2b3, c4e3, d8d6, g6e4, d6d7, e4g6, b3b2, e3c4, b2b3, c4e3, d7e7, g6d3, e7e8, d3g6, e8e7, g6d3, e7f7, f4e5, f7b7, d3g6, b7b6, g6e4, b6b4, e4g6, b4b8, e5e6, b8d8, e6e7, d8c8, e7d6, b3b4, e3c2, b4b5, g6d3, b5a4, d3g6, c8f8, d6e5, f8d8, c2e3, a4a3, e3c4, a3a2, c4e3, a2b2, e3c4, b2c1, c4e3, c1b2, e3c4, b2b3, c4e3, d8h8, e5d4, h8h3, g6c2, b3b2, c2f5, h3g3, f5d3, b2c1, e3f5, g3f3, d4c3, g7g6, f5h4, f3f6, d3g6, f6c6, c3d4, c6d6, d4e5, d6a6, g6d3, a6a4, d3e4, c1b2, h4g2, b2b3, g2e3, b3b4, e5d4, b4b5, d4d5, b5b6, e4c2, a4a6, c2d3, a6a8, d3e4, a8a4, e4c2, a4a6, c2e4, b6c7, d5e5, a6a5, e4d5, a5a4, d5e4, a4a5, e4d5, c7d8, e3c4, a5a2, d5e4, d8e7, e4d5, a2e2, d5e4, e2a2, e4d5, a2e2, d5e4, e2e1, c4b6, e7e8, b6d5, e8f8, e5f5, e1a1, d5f4, a1e1, f5e5, e1a1, f4e6, f8f7, e6f4, a1a5, f4d5, f7e8, e5d6, a5a6, d6e5, a6a1, e4f5, e8f7, f5e4, f7f8, e5e6, a1f1, e6e5, f8f7, d5e3, f1e1, e3d5, e1a1, e4f5, a1e1, e5d4, f7f8, f5e4, e1d1, d4e5, f8f7, e4f5, d1d5, e5d5","[0.0093, 0.0232, -0.0023, 0.0185, 0.0062, 0.0045, -0.0024, -0.0105, -0.0114, -0.0109, -0.0105, -0.0115, -0.0095, -0.0094, -0.0102, -0.0098, -0.0091, -0.0093, -0.0094, -0.0095, -0.0089, -0.0116, -0.011, -0.0111, -0.0114, -0.0103, -0.0105, -0.0115, -0.0103, -0.0114, -0.0106, -0.0089, -0.0102, -0.0109, -0.009, -0.0104, -0.0109, -0.0117, -0.0088, -0.0104, -0.0102, -0.0131, -0.0111, -0.01, -0.0085, -0.0103, -0.0123, -0.011, -0.0108, -0.0106, -0.0121, -0.0103, -0.011, -0.011, -0.0109, -0.0117, -0.0103, -0.0119, -0.0117, -0.0125, -0.0117, -0.0125, -0.0128, -0.0116, -0.0131, -0.0116, -0.0101, -0.0117, -0.0115, -0.01, -0.0107, -0.0103, -0.011, -0.0098, -0.0089, -0.0099, -0.0089, -0.0098, -0.0086, -0.0082, -0.0098, -0.0092, -0.0098, -0.0089, -0.0088, -0.0085, -0.0085, -0.0085, -0.0088, -0.0104, -0.0106, -0.0099, -0.0102, -0.0091, -0.0088, -0.0088, -0.0085, -0.0082, -0.0079, -0.0085, -0.0082, -0.0083, -0.008, -0.0078, -0.0078, -0.0073, -0.0075, -0.0076, -0.0074, -0.0069, -0.0069, -0.0073, -0.0075, -0.0073, -0.0082, -0.007, -0.0071, -0.0068, -0.0068, -0.0068, -0.0068, -0.0068, -0.0072, -0.0066, -0.0066, -0.0072, -0.0064, -0.0064, -0.0065, -0.0064, -0.0064, -0.0064, -0.0067, -0.0069, -0.0066, -0.0065, -0.0069, -0.0072, -0.0072, -0.0071, -0.0079, -0.0071, -0.0068, -0.0066, -0.0069, -0.0068, -0.0067, -0.0067, -0.0075, -0.0065, -0.0068, -0.0068, -0.0064, -0.0064, -0.0065, -0.0067, -0.0069, -0.0074, -0.0073, -0.0071, -0.0069, -0.0072, -0.0069, -0.0067, -0.0074, -0.0064, -0.0064, -0.0063, -0.0064, -0.0068, -0.0064, -0.0067, -0.0067, -0.007, -0.0066, -0.0071, -0.0078, -0.0068, -0.0067, -0.0071, -0.0065, -0.0064, -0.0063, -0.007, -0.0067, -0.0068, -0.0075, -0.0093, -0.0091, -0.0097, -0.0077, -0.0087, -0.0078, -0.0076, -0.0072, -0.007, -0.0092, -0.0095, -0.0088, -0.0089, -0.0074, -0.0077, -0.008, -0.0089, -0.0085, -0.0083, -0.0085, -0.0089, -0.0083, -0.0079, -0.0075, -0.0075, -0.0075, -0.0085, -0.0081, -0.0087, -0.0088, -0.0069, -0.0067, -0.0071, -0.0064, -0.0068, -0.0068, -0.0062, -0.0063, -0.0063, -0.0063, -0.0062, -0.0063, -0.0061, -0.0069, -0.006, -0.0062, -0.0061, -0.006, -0.0065, -0.0061, -0.006, -0.0058, -0.0065, -0.0059, -0.0058, -0.0073, -0.006, -0.0058, -0.0064, -0.0058, -0.0063, -0.0058, -0.0058, -0.0058, -0.0064, -0.0057, -0.0057, -0.0056, -0.0055, -0.0057, -0.0057, -0.006, -0.006, -0.0059, -0.0051, -0.0057, -0.0057, -0.0053, -0.0053, -0.0053, -0.0048, -0.0052, -0.0051, -0.0048, -0.0048, -0.005, -0.0048, -0.0046, -0.0046, -0.0046, -0.0045, -0.0044, -0.0052, -0.0042, -0.0045, -0.0045, -0.0044, -0.0042, -0.0042, -0.0041, -0.0045, -0.004, -0.004, -0.0039, -0.004, -0.0039, -0.0039, -0.0038, -0.0038, -0.0038, -0.0039, -0.0037, -0.0037, -0.0037, -0.0037, -0.0037, -0.0037, -0.0035, -0.0034, -0.0034, -0.0034, -0.0031, -0.0028, -0.0005, -0.0007, -0.0003, -0.0002, -0.0004, -0.0005, -0.0005, -0.0005, -0.0002, -0.0003, -0.0004, -0.0003, -0.0004, -0.0004, -0.0003, -0.0005, -0.0006, -0.0005, -0.0005, -0.0005, -0.0005, -0.0004, -0.0004, -0.0003, -0.0003, -0.0003, -0.0002, -0.0002, -0.0002, -0.0002, -0.0002, -0.0002, -0.0002, -0.0002, -0.0002, -0.0002, -0.0002, -0.0002, -0.0002, -0.0004, -0.0005, -0.0003, -0.0002, -0.0002, -0.0002, -0.0001, -0.0001, -0.0001, -0.0001, -0.0001, -0.0001, -0.0001, -0.0001, -0.0001, -0.0001, -0.0001, -0.0001, -0.0001, -0.0001, -0.0001, -0.0001, -0.0001, -0.0001, -0.0001, -0.0001, -0.0001, -0.0001, -0.0001, -0.0001, -0.0001, -0.0001, -0.0001, 0.0, 0.0, 0.0, 0.0, 0.0, 0.0, 0.0, 0.0, 0.0, 0.0, 0.0, 0.0, 0.0, 0.0, 0.0, 0.0, 0.0, 0.0, 0.0, 0.0, 0.0]","-3, -3, -3, -3, -3, -3, 0, -1, -1, -2, -1, -1, -1, -4, -1, -1, -1, -1, -1, -1, -1, -1, -1, -1, -1, -1, -1, -1, -1, -1, -1, -1, -1, -6, -1, -1, 0, -1, -1, -1, -1, -4, -1, -10, -1, -2, -1, -1, -1, -1, -1, -1, -1, -2, -2, -2, 1, 1, 1, -4, -1, -1, -1, -1, -1, -1, -1, -1, -1, -1, -1, -1, -1, -1, 0, 0, 0, 0, 0, -1, -1, -1, 0, 0, 0, -1, 0, -1, -1, -1, -1, -1, -1, -1, -1, -1, -1, -1, -1, -1, -1, -1, -1, -1, -1, -1, -1, -1, -1, -1, -1, -1, -1, -1, -1, -1, -1, -1, -1, -1, -1, -1, -1, -1, -1, -1, -1, -1, -1, -1, -1, -1, -1, -1, -1, -1, -1, -1, -1, -1, -1, -1, -1, -1, -1, -1, -1, -1, -1, -1, -1, -1, -1, -1, -1, -1, -1, -1, -1, -1, -1, -1, -1, -1, -1, -1, -1, -1, -1, -1, -1, -1, -1, -1, -1, -1, -1, -1, -1, -1, -1, -1, -1, -1, -1, -1, -1, -1, -1, -1, -1, -1, -1, -1, -1, -1, -1, -1, -1, -1, -1, -1, -1, -1, -1, -1, -1, -1, -1, -1, -1, -1, -1, -1, -1, -1, -1, -1, -1, -1, -1, -1, -1, -1, -1, -1, -1, -1, -1, -1, -1, -1, -1, -1, -1, -1, -1, -1, -1, -1, -1, -1, -1, -1, -1, -1, -1, -1, -1, -1, -1, -1, -1, -1, -1, -1, -1, -1, -1, -1, -1, -1, -1, -1, -1, -1, -1, -1, -1, -1, -1, -1, -1, -1, -1, -1, -1, -1, -1, -1, -1, -1, -1, -1, -1, -1, -1, -1, -1, -1, -1, -1, -1, -1, -1, -1, -1, -1, -1, -1, -1, -1, -1, -1, -1, -1, -1, -1, 0, 0, 0, 0, 1, 1, 1, 1, 1, 1, 1, 1, 1, 1, 1, 1, 1, 1, 1, 1, 1, 1, 1, 1, 1, 1, 1, 1, 1, 1, 1, 1, 1, 1, 1, 1, 1, 1, 1, 1, 1, 1, 1, 1, 1, 1, 1, 1, 1, 1, 1, 1, 1, 1, 1, 1, 1, 1, 1, 1, 1, 1, 1, 1, 1, 1, 1, 1, 1, 1, 1, 1, 1, 1, 1, 1, 1, 1, 1, 1, 1, 1, 1, 1, 1, 1, 1, 1, 1, 1, 1, 1, 1, -2, 3",403
