winner,loser,white_pieces,black_pieces,moves,evaluations
Black,White,<alpha_pawn.AlphaPawn object at 0x0000029132C69B50>,Stockfish,"d1f3, b8c6, h2h3, d7d5, a2a4, d5e4, b2b3, e4f3, b1c3, f3g2, c3e4, g2h1q, b3b4, h1e4, f1e2, c6b4, h3h4, b4c2, e1d1, c2a1, e2h5, d8d3, c1a3, d3f1","[-21, -39, -59, -45, -128, -123, -742, -771, -867, -866, -2217, -2256, -2558, -2630, -2685, -2771, -3013, -3054, -3188, -9989, -9997, -9998, -9999, -10000]"
White,Black,Stockfish,<alpha_pawn.AlphaPawn object at 0x0000029132C69B50>,"b8d7, c1f4, a7a6, e2e3, d7b8, c2c4, f7f6, b1c3, c8d7, c4d5, b8c6, d5c6, g7g5, c6d7, e8d7, f4g3, f8g7, h2h3, b7b6, f1c4, d8f8, a1c1, f8b8, d1b3, b8f8, c4e6, d7d8, b3d5, d8e7, d5d7","[6, 1, 15, 19, 84, 73, 133, 130, 314, 305, 603, 601, 820, 789, 857, 841, 932, 917, 985, 953, 1030, 1012, 1112, 1243, 1577, 1968, 9995, 9996, 9999, 10000]"
Black,White,<alpha_pawn.AlphaPawn object at 0x0000029132C69B50>,Stockfish,"f8b4, h2h3, b8c6, b1c3, g8f6, e2e4, d7d5, f1b5, d5d4, c3e2, f6e4, a2a3, b4d6, b5a6, b7a6, e1f1, e4c5, c1b2, e8g8, e2c3, d4c3, f2f3, c3b2, c2c3, b2a1q, d1e1, a1a3, g2g4, c5d3, e1e5, a3a1, f1e2, d6e5, c3c4, a1e1","[-161, -207, -200, -295, -262, -305, -303, -305, -302, -283, -292, -341, -321, -708, -689, -775, -796, -826, -810, -916, -948, -1253, -1234, -1578, -1567, -2033, -2160, -2370, -2780, -9995, -9996, -9997, -9998, -9999, -10000]"
White,Black,Stockfish,<alpha_pawn.AlphaPawn object at 0x0000029132C69B50>,"b8a6, g1f3, e7e6, e2e4, a6b8, b1c3, f7f5, e4f5, g7g6, f5g6, b8c6, d4d5, f8a3, g6g7, h7h5, g7h8q, e6d5, h8g8, e8e7, c1g5, e7d6, d1d5","[96, 114, 138, 134, 188, 182, 341, 348, 487, 501, 584, 577, 835, 834, 1782, 2204, 9997, 9998, 9998, 9999, 9999, 10000]"
Black,White,<alpha_pawn.AlphaPawn object at 0x0000029132C69B50>,Stockfish,"c7c5, a2a4, c5d4, a4a5, g8f6, c1e3, d4e3, f3d4, e3f2, e1d2, e6e5, h2h4, e5d4, a1a2, f8d6, d2c1, d6f4, e2e3, f4e3, d1d2, e3d2, c1d1, d2h6, c2c3, c8g4, d1c2, g4f5, f1d3, f5d3, c2d1, d8c8, c3c4, c8g4","[-14, -71, -92, -95, -91, -753, -745, -783, -783, -847, -864, -911, -934, -997, -1016, -1006, -1039, -1071, -1057, -1147, -1175, -1387, -1478, -1531, -1568, -1563, -1585, -1617, -1691, -9994, -9995, -9999, -10000]"
