winner,loser,white_pieces,black_pieces,moves,evaluations,material_advantage,move_count
Draw,Draw,Stockfish,Stockfish,"d6d5, b1d2, c7c5, g1f3, c5d4, e4d5, d8d5, f1c4, d5d6, e1g1, g8f6, d2b3, b8c6, b3d4, c6d4, f3d4, f8e7, f1e1, e8g8, c2c3, c8d7, d1f3, a8c8, c4b3, a7a5, c1f4, d6b6, a1b1, a5a4, b3c2, a4a3, b2a3, b6a5, f3e2, a5c3, f4e5, c3a3, b1b7, f8d8, e5c7, d8e8, c7e5, e8d8, e5c7, d8e8, c7e5, a3a8, e5f6, a8b7, f6e7, b7a7, e2d3, c8c2, d3c2, a7d4, e7c5, d4a4, c2a4, d7a4, e1c1, e8a8, a2a3, f7f6, c5b4, e6e5, c1c7, h7h5, h2h3, a8d8, b4c5, d8d1, g1h2, d1c1, c5b6, c1a1, c7c8, g8f7, c8c7, f7g8, c7a7, a4c6, a3a4, a1a2, b6e3, g8h7, e3c5, a2c2, c5b6, c6e4, h2g1, e4d3, a4a5, c2c1, g1h2, c1c2, h2g1, c2c1, g1h2, d3b5, b6d8, h7g6, d8b6, g6h7, b6e3, c1c2, a7b7, b5f1, b7a7, f1b5, a7b7, b5e2, b7d7, e2f1, d7d2, c2c3, d2d7, f1b5, d7d8, c3a3, d8a8, a3a2, e3c5, b5c4, h2g1, a2a1, g1h2, a1a2, h2g1, a2a1, g1h2, a1a2, h2g1, a2a1, g1h2, a1a2, h2g1, a2a4, a8a7, a4a1, g1h2, h7g8, a7a8, g8h7, c5b6, c4b5, b6c5, b5c6, a8c8, c6b5, c8a8, b5c6, a8a7, h7g8, a7c7, c6e4, c7c8, g8h7, c5b6, a1a3, c8c7, e4d3, c7d7, d3b5, d7d8, b5f1, d8d5, a3a2, d5d7, a2a4, d7e7, h7g8, e7e8, g8f7, e8a8, a4a2, a8a7, f7g8, a7d7, a2a1, d7c7, a1a3, c7c8, g8f7, c8c7, f7g6, c7a7, f1c4, b6c5, a3a2, h2g3, c4f1, g3h2, g6f5, a7g7, a2a5, c5e3, f1e2, g7c7, a5a8, c7c2, e2f1, c2d2, a8a6, f2f3, f5g6, h2g1, a6a1, d2b2, f1c4, g1h2, a1a6, e3b6, c4d3, b2b4, a6a2, h2g1, a2a1, g1f2, a1a2, f2g1, a2a1, g1f2, a1a2, f2g1, g6f5, b6c5, a2a1, g1h2, f5g6, c5f2, a1a6, b4b2, d3f1, f2e3, f1c4, b2d2, a6a2, d2a2, c4a2, h2g1, f6f5, e3b6, a2d5, f3f4, e5e4, b6f2, d5a2, f2c5, e4e3, c5e3, g6h6, g1f1, h6h7, g2g4, h5g4, h3g4, f5g4, f4f5, h7g8, f5f6, g8f7, e3b6, g4g3, b6g1, g3g2, f1e1, f7f6, g1d4, f6e6, e1f2, g2g1q, f2g1, a2b1, d4c5, b1a2, c5f2, a2b1, f2b6, b1a2, b6f2, a2b1, f2b6, e6f6, b6d4, f6f5, d4a1, b1c2, g1f2, c2b1, a1b2, b1a2, b2a1, f5e6, f2g3, a2b1, a1b2, b1a2, b2a1, a2b1, a1b2, e6f5, b2g7, f5e4, g7a1, b1a2, a1b2, a2b1, b2a1, b1a2, a1b2, a2d5, b2c3, e4f5, c3a1, f5e4, a1b2, d5g8, g3f2, e4f4, b2c3, g8d5, c3g7, f4f5, g7a1, f5g6, a1b2, g6f5, b2a1, d5f7, a1b2, f7a2, f2g3, a2f7, b2a1, f7g6, a1b2, g6h5, b2a1, h5d1, a1b2, d1c2, b2a1, c2b1, a1b2, b1a2, g3f2, a2c4, b2a1, f5f4, a1b2, c4g8, b2d4, g8d5, f2g1, f4f5, g1h2, f5g5, d4g1, d5b3, g1c5, b3d5, h2g3, d5e6, c5e3, g5g6, g3h2, e6c4, h2g3, g6h5, e3a7, c4f1, a7f2, f1e2, f2g1, e2a6, g1f2, a6f1, f2e1, f1e2, e1d2, e2d1, d2c1, d1e2, c1b2, e2c4, b2d4, c4f1, d4a1, f1e2, a1b2, e2c4, b2a3, c4f1, a3b4, f1e2, b4e1, e2c4, e1f2, c4f1, f2e1, f1e2, e1d2, e2d1, d2c1, d1e2, c1b2, e2a6, b2e5, a6f1, e5g7, f1e2, g7a1, e2a6, a1b2, a6f1, b2a1, f1e2, a1b2, e2a6, b2a3, a6f1, a3f8","[0.004, 0.0035, 0.0019, 0.004, 0.0039, 0.0034, 0.0039, 0.0027, 0.0022, 0.0024, 0.0025, 0.0028, 0.003, 0.0034, 0.0032, 0.0034, 0.0033, 0.0025, 0.0026, 0.0026, 0.0021, 0.0023, 0.0025, 0.0008, 0.0024, 0.0015, 0.0016, 0.0025, 0.0019, 0.0022, 0.004, 0.0013, 0.0013, 0.0008, 0.0, 0.0, 0.0, 0.0, -0.0002, 0.0, -0.0008, -0.0005, -0.0003, -0.0006, 0.0, -0.0002, 0.0, -0.0003, 0.0, -0.0001, 0.0, 0.0, 0.0, 0.0, 0.0, 0.0, 0.0, 0.0, 0.0, 0.0, 0.0, 0.0, 0.0, 0.0, 0.0, 0.0, 0.0, 0.0, 0.0, 0.0, 0.0, 0.0, 0.0, 0.0, 0.0, 0.0, 0.0, 0.0, 0.0, 0.0, 0.0, 0.0, 0.0, 0.0, 0.0, 0.0, 0.0, 0.0, 0.0, 0.0, 0.0, 0.0, 0.0, 0.0, 0.0, 0.0, 0.0, 0.0, 0.0, 0.0, 0.0, 0.0, 0.0, 0.0, 0.0, 0.0, 0.0, 0.0, 0.0, 0.0, 0.0, 0.0, 0.0, 0.0, 0.0, 0.0, 0.0, 0.0, 0.0, 0.0, 0.0, 0.0, 0.0, 0.0, 0.0, 0.0, 0.0, 0.0, 0.0, 0.0, 0.0, 0.0, 0.0, 0.0, 0.0, 0.0, 0.0, 0.0, 0.0, 0.0, 0.0, 0.0, 0.0, 0.0, 0.0, 0.0, 0.0, 0.0, 0.0, 0.0, 0.0, 0.0, 0.0, 0.0, 0.0, 0.0, 0.0, 0.0, 0.0, 0.0, 0.0, 0.0, 0.0, 0.0, 0.0, 0.0, 0.0, 0.0, 0.0, 0.0, 0.0, 0.0, 0.0, 0.0, 0.0, 0.0, 0.0, 0.0, 0.0, 0.0, 0.0, 0.0, 0.0, 0.0, 0.0, 0.0, 0.0, 0.0, 0.0, 0.0, 0.0, 0.0, 0.0, 0.0, 0.0, 0.0, 0.0, 0.0, 0.0, 0.0, 0.0, 0.0, 0.0, 0.0, 0.0, 0.0, 0.0, 0.0, 0.0, 0.0, 0.0, 0.0, 0.0, 0.0, 0.0, 0.0, 0.0, 0.0, 0.0, 0.0, 0.0, 0.0, 0.0, 0.0, 0.0, 0.0, 0.0, 0.0, 0.0, 0.0, 0.0, 0.0, 0.0, 0.0, 0.0, 0.0, 0.0, 0.0, 0.0, 0.0, 0.0, 0.0, 0.0, 0.0, 0.0, 0.0, 0.0, 0.0, 0.0, 0.0, 0.0, 0.0, 0.0, 0.0, 0.0, 0.0, 0.0, 0.0, 0.0, 0.0, 0.0, 0.0, 0.0, 0.0, 0.0, 0.0, 0.0, 0.0, 0.0, 0.0, 0.0, 0.0, 0.0, 0.0, 0.0, 0.0, 0.0, 0.0, 0.0, 0.0, 0.0, 0.0, 0.0, 0.0, 0.0, 0.0, 0.0, 0.0, 0.0, 0.0, 0.0, 0.0, 0.0, 0.0, 0.0, 0.0, 0.0, 0.0, 0.0, 0.0, 0.0, 0.0, 0.0, 0.0, 0.0, 0.0, 0.0, 0.0, 0.0, 0.0, 0.0, 0.0, 0.0, 0.0, 0.0, 0.0, 0.0, 0.0, 0.0, 0.0, 0.0, 0.0, 0.0, 0.0, 0.0, 0.0, 0.0, 0.0, 0.0, 0.0, 0.0, 0.0, 0.0, 0.0, 0.0, 0.0, 0.0, 0.0, 0.0, 0.0, 0.0, 0.0, 0.0, 0.0, 0.0, 0.0, 0.0, 0.0, 0.0, 0.0, 0.0, 0.0, 0.0, 0.0, 0.0, 0.0, 0.0, 0.0, 0.0, 0.0, 0.0, 0.0, 0.0, 0.0, 0.0, 0.0, 0.0, 0.0, 0.0, 0.0, 0.0, 0.0, 0.0, 0.0, 0.0, 0.0, 0.0, 0.0, 0.0, 0.0, 0.0, 0.0, 0.0, 0.0, 0.0, 0.0, 0.0, 0.0, 0.0, 0.0, 0.0, 0.0, 0.0, 0.0, 0.0, 0.0, 0.0, 0.0, 0.0, 0.0, 0.0, 0.0, 0.0, 0.0, 0.0, 0.0, 0.0, 0.0, 0.0, 0.0, 0.0, 0.0, 0.0, 0.0, 0.0, 0.0, 0.0, 0.0, 0.0, 0.0, 0.0, 0.0]","0, 0, 0, 0, -1, 0, -1, -1, -1, -1, -1, -1, -1, 0, -3, 0, 0, 0, 0, 0, 0, 0, 0, 0, 0, 0, 0, 0, 0, 0, 0, 1, 1, 1, 0, 0, -1, 0, 0, 0, 0, 0, 0, 0, 0, 0, 0, 3, -2, 1, 1, 1, -2, 3, 0, 0, 0, 9, 0, 0, 0, 0, 0, 0, 0, 0, 0, 0, 0, 0, 0, 0, 0, 0, 0, 0, 0, 0, 0, 0, 0, 0, 0, 0, 0, 0, 0, 0, 0, 0, 0, 0, 0, 0, 0, 0, 0, 0, 0, 0, 0, 0, 0, 0, 0, 0, 0, 0, 0, 0, 0, 0, 0, 0, 0, 0, 0, 0, 0, 0, 0, 0, 0, 0, 0, 0, 0, 0, 0, 0, 0, 0, 0, 0, 0, 0, 0, 0, 0, 0, 0, 0, 0, 0, 0, 0, 0, 0, 0, 0, 0, 0, 0, 0, 0, 0, 0, 0, 0, 0, 0, 0, 0, 0, 0, 0, 0, 0, 0, 0, 0, 0, 0, 0, 0, 0, 0, 0, 0, 0, 0, 0, 0, 0, 0, 0, 0, 0, 0, 0, 0, 0, 0, 1, 0, 0, 0, 0, 0, 0, 0, 0, 0, 0, 0, 0, 0, 0, 0, 0, 0, 0, 0, 0, 0, 0, 0, 0, 0, 0, 0, 0, 0, 0, 0, 0, 0, 0, 0, 0, 0, 0, 0, 0, 0, 0, 0, 5, 0, 0, 0, 0, 0, 0, 0, 0, 0, 0, 0, 1, 1, 1, 1, 1, 0, 1, 0, 0, 0, 0, 0, 0, 0, 0, 0, 0, -1, -1, -1, -1, -9, 0, 0, 0, 0, 0, 0, 0, 0, 0, 0, 0, 0, 0, 0, 0, 0, 0, 0, 0, 0, 0, 0, 0, 0, 0, 0, 0, 0, 0, 0, 0, 0, 0, 0, 0, 0, 0, 0, 0, 0, 0, 0, 0, 0, 0, 0, 0, 0, 0, 0, 0, 0, 0, 0, 0, 0, 0, 0, 0, 0, 0, 0, 0, 0, 0, 0, 0, 0, 0, 0, 0, 0, 0, 0, 0, 0, 0, 0, 0, 0, 0, 0, 0, 0, 0, 0, 0, 0, 0, 0, 0, 0, 0, 0, 0, 0, 0, 0, 0, 0, 0, 0, 0, 0, 0, 0, 0, 0, 0, 0, 0, 0, 0, 0, 0, 0, 0, 0, 0, 0, 0, 0, 0, 0, 0, 0, 0, 0, 0, 0, 0, 0, 0, 0, 0, 0, 0, 0, 0, 0, 0, 0, 0, 0, 0, 0, 0, 0, 0, 0, 0",422
White,Black,Stockfish,Stockfish,"e7e6, b1c3, d7d5, g1f3, g8f6, c1g5, f8e7, e2e3, e8g8, d1c2, b8d7, c4d5, e6d5, f1d3, h7h6, g5h4, c7c6, e1g1, a7a6, f1d1, f8e8, h4g3, d7f8, h2h3, e7d6, f3e5, f6h5, g3h2, h5f6, f2f4, c6c5, h2g3, f6h5, e5f7, g8f7, d4c5, e8e3, g3f2, d6c5, c3d5, e3d3, d1d3, c5f2, c2f2, h5f6, f4f5, f6d5, a1d1, d8b6, d3d5, b6f2, g1f2, a8a7, g2g4, b7b6, d5d6, b6b5, d1c1, c8d7, f2g3, a6a5, c1c5, a5a4, h3h4, a7b7, g3f2, f8h7, f2f3, h7f8, d6a6, d7e8, c5e5, e8d7, e5c5, d7e8, f3f4, e8d7, f4e3, f8h7, e3f4, h7f8, c5c1, b5b4, c1c5, d7e8, g4g5, h6g5, h4g5, g7g6, f4g3, b4b3, a2a3, g6f5, c5f5, f7g8, f5e5, e8b5, a6a5, b5c6, a5a6, c6b5, a6a5, b5c6, e5c5, c6d7, a5a6, g8f7, g3f3, d7b5, a6d6, f8g6, d6f6, f7g7, f6e6, b5d7, e6e1, b7a7, e1e4, g7f7, e4b4, f7e6, b4b6, e6f7, b6d6, f7g7, f3e3, d7e8, d6d4, e8f7, e3f3, g6f8, c5e5, f8e6, d4e4, a7a6, f3e3, g7g6, e4h4, g6g7, h4b4, g7g6, b4h4, g6g7, e5f5, g7g6, f5b5, g6g7, h4g4, g7g6, g4h4, g6g7, b5e5, a6a7, h4e4, a7a6, e4h4, a6a7, h4b4, e6c7, b4d4, c7e6, d4c4, a7a6, c4h4, a6a7, h4c4, a7a6, e5f5, a6a7, c4b4, e6c7, b4d4, c7e6, d4h4, g7g6, f5b5, e6c7, b5c5, c7d5, e3d3, g6g5, h4d4, g5f6, d4d5, f7d5, c5d5, a7c7, d5d4, c7c2, d4a4, c2b2, d3c3, b2e2, a4d4, b3b2, d4d1, f6e5, a3a4, e2e4, c3b2, e4a4, b2c3, a4a3, c3b4, a3e3, d1d8, e3e4, b4c3, e4a4, d8e8, e5d5, e8d8, d5c6, d8d1, a4a3, c3b4, a3a8, b4c4, a8a4, c4b3, a4e4, d1a1, e4e3, b3c4, e3e4, c4d3, e4e8, d3d4, e8d8, d4c3, c6c5, a1a5, c5d6, c3d3, d6e7, d3e4, d8d1, a5a6, d1e1, e4d3, e7d7, a6a7, d7c8, a7a8, c8c7, a8a7, c7b6, a7a3, e1d1, d3c3, d1c1, c3d2, c1b1, a3a4, b1h1, d2c2, h1h2, c2c3, h2h1, c3c2, h1h5, c2d3, h5h3, d3d2, h3h2, d2e3, h2h1, e3d3, h1d1, d3e4, d1e1, e4d5, e1d1, d5e5, d1e1, e5d4, b6c6, a4a6, c6b7, a6a3, e1d1, d4c5, b7c7, a3a8, d1c1, c5d5, c7b6, a8b8, b6c7, b8a8, c1e1, a8a7, c7b6, a7a8, e1d1, d5c4, d1c1, c4d5, c1d1, d5c4, d1a1, a8a1, b6c7, a1d1, c7b6, d1d6, b6b7, c4b5, b7c7, d6d2, c7b7, d2c2, b7a8, b5b6, a8b8, c2c1, b8a8, c1c8","[0.0063, 0.0056, 0.0055, 0.0056, 0.0052, 0.005, 0.0055, 0.005, 0.0057, 0.0047, 0.0049, 0.0053, 0.0052, 0.0051, 0.0057, 0.0055, 0.0053, 0.0059, 0.0051, 0.0049, 0.0056, 0.0063, 0.005, 0.0071, 0.0062, 0.0076, 0.0093, 0.0058, 0.005, 0.0053, 0.0044, 0.0053, 0.006, 0.0022, 0.0066, 0.0053, 0.0055, 0.0045, 0.0054, 0.0057, 0.0061, 0.0059, 0.0061, 0.0058, 0.0043, 0.0066, 0.006, 0.0066, 0.0057, 0.0064, 0.006, 0.0065, 0.0056, 0.0055, 0.0063, 0.0065, 0.0053, 0.0054, 0.0049, 0.0053, 0.0048, 0.0049, 0.0049, 0.0054, 0.0046, 0.0046, 0.0049, 0.0045, 0.0048, 0.0041, 0.004, 0.0042, 0.0039, 0.004, 0.0038, 0.0042, 0.0042, 0.0053, 0.0051, 0.0049, 0.0053, 0.0047, 0.004, 0.0032, 0.0026, 0.0025, 0.0015, 0.0016, 0.0017, 0.0015, 0.0021, 0.0016, 0.0008, 0.001, 0.0007, 0.0009, 0.0011, 0.0017, 0.0011, 0.0008, 0.0006, 0.0007, 0.0005, 0.0005, 0.0001, 0.0004, 0.0007, 0.0008, 0.0004, 0.0, 0.0, 0.0, 0.0, 0.0, 0.0005, 0.0, 0.0, 0.0, 0.0, 0.0, 0.0, 0.0, 0.0, 0.0, 0.0, 0.0, 0.0, 0.0, 0.0, 0.0, 0.0, 0.0, 0.0, 0.0, 0.0, 0.0, 0.0, 0.0, 0.0, 0.0, 0.0, 0.0, 0.0, 0.0, 0.0, 0.0, 0.0, 0.0, 0.0, 0.0, 0.0, 0.0, 0.0, 0.0, 0.0, 0.0, 0.0, 0.0, 0.0, 0.0, 0.0, 0.0, 0.0, 0.0, 0.0, 0.0, 0.0, 0.0, 0.0, 0.0, 0.0, 0.0, 0.0, 0.0, 0.0, 0.0, 0.0, -0.0002, -0.0003, 0.0, -0.0001, 0.0, 0.0, 0.0, 0.0, 0.0, 0.0, 0.0, 0.0, 0.0, 0.0, 0.0, 0.0, 0.0, 0.0, 0.0, 0.0, 0.0, 0.0, 0.0, 0.0, 0.0, 0.0, 0.0, 0.0, 0.0, 0.0, 0.0, 0.0, 0.0, 0.0, 0.0, 0.0, 0.0, 0.0, 0.0, 0.0, 0.0, 0.0, 0.0, 0.0, 0.0, 0.0, 0.0, 0.0, 0.0, 0.0, 0.0, 0.0, 0.0, 0.0, 0.0, 0.0, 0.0, 0.0, 0.0, 0.0, 0.0, 0.0, 0.0, 0.0, 0.0, 0.0, 0.0, 0.0, 0.0, 0.0, 0.0, 0.0, 0.0, 0.0, 0.0, 0.0, 0.0, 0.0, 0.0, 0.0, 0.0, 0.0, 0.0, 0.0, 0.0, 0.0, 0.0, 0.0, 0.0, 0.0, 0.0, 0.0, 0.0, 0.0, 0.0, 0.0, 0.0, 0.0, 0.0, 0.0, 0.0, 0.0, 0.0, 0.0, 0.0, 0.0, 0.0, 0.0, 0.0, 0.0, 0.0, 0.0, 0.0, 0.0, 0.0, 0.0, 0.0, 0.0, 0.0, 0.0, 0.0, 0.0, 0.0, 0.0545, 0.9992, 0.9992, 0.9993, 0.9993, 0.9994, 0.9994, 0.9995, 0.9995, 0.9996, 0.9996, 0.9997, 0.9997, 0.9998, 0.9998, 0.9999, 0.9999, 1.0]","0, 0, 0, 0, 0, 0, 0, 0, 0, 0, 0, 1, 0, 0, 0, 0, 0, 0, 0, 0, 0, 0, 0, 0, 0, 0, 0, 0, 0, 0, 0, 0, 0, 1, -2, -1, -2, -2, -3, -2, -5, 0, -3, 0, 0, 0, -3, -3, -3, 0, -9, 0, 0, 0, 0, 0, 0, 0, 0, 0, 0, 0, 0, 0, 0, 0, 0, 0, 0, 0, 0, 0, 0, 0, 0, 0, 0, 0, 0, 0, 0, 0, 0, 0, 0, 0, -1, 0, 0, 0, 0, 0, -1, 0, 0, 0, 0, 0, 0, 0, 0, 0, 0, 0, 0, 0, 0, 0, 0, 0, 0, 0, 0, 0, 0, 0, 0, 0, 0, 0, 0, 0, 0, 0, 0, 0, 0, 0, 0, 0, 0, 0, 0, 0, 0, 0, 0, 0, 0, 0, 0, 0, 0, 0, 0, 0, 0, 0, 0, 0, 0, 0, 0, 0, 0, 0, 0, 0, 0, 0, 0, 0, 0, 0, 0, 0, 0, 0, 0, 0, 0, 0, 0, 0, 0, 0, 0, 0, 0, 0, -1, -1, -1, 2, -3, 0, 0, 0, 0, 1, 0, 0, 0, 0, 0, 0, 0, 0, 0, 1, 0, 0, 0, 0, 0, 0, 0, 0, 0, 0, 0, 0, 0, 0, 0, 0, 0, 0, 0, 0, 0, 0, 0, 0, 0, 0, 0, 0, 0, 0, 0, 0, 0, 0, 0, 0, 0, 0, 0, 0, 0, 0, 0, 0, 0, 0, 0, 0, 0, 0, 0, 0, 0, 0, 0, 0, 0, 0, 0, 0, 0, 0, 0, 0, 0, 0, 0, 0, 0, 0, 0, 0, 0, 0, 0, 0, 0, 0, 0, 0, 0, 0, 0, 0, 0, 0, 0, 0, 0, 0, 0, 0, 0, 0, 0, 0, 0, 0, 0, 0, 0, 5, 5, 5, 5, 5, 5, 5, 5, 5, 5, 5, 5, 5, 5, 5, 5, 5",318
Draw,Draw,Stockfish,Stockfish,"e4d5, d8d5, g1f3, b8c6, b1c3, d5d8, f1b5, c8d7, e1g1, e7e6, f1e1, g8f6, b5c6, d7c6, f3e5, a8c8, d2d3, f8d6, c1f4, e8g8, a2a4, h7h6, b2b3, b7b6, f4g3, d8c7, a4a5, f8d8, e5c6, c7c6, d1f3, c6f3, g2f3, f6d5, c3d5, e6d5, g3d6, d8d6, e1e7, a7a6, a5b6, d6b6, g1f1, c5c4, b3c4, d5c4, d3d4, b6b2, e7e2, c8c6, c2c3, b2b5, e2e4, b5b3, e4e3, g7g5, a1a4, b3b1, e3e1, b1b2, e1e2, b2b1, e2e1, b1b2, e1e2, b2b3, e2e3, g8f8, h2h3, b3b1, e3e1, b1b3, e1e3, b3b1, e3e1, b1b2, e1e2, b2b1, e2e1, b1b2, e1e2, b2b3, e2e3, b3b1, e3e1, b1b2, e1e2, b2b1, e2e1","[0.0014, 0.0001, 0.0002, 0.0008, 0.0005, 0.001, 0.0009, 0.0008, 0.0008, 0.0013, 0.0008, 0.0006, 0.0006, 0.0003, 0.0, 0.0002, 0.0002, 0.0, 0.0, -0.0003, -0.0003, -0.0001, -0.0003, -0.0003, -0.0001, -0.0001, 0.0, 0.0, 0.0, 0.0, 0.0, 0.0001, 0.0, 0.0, -0.0003, -0.0002, 0.0, -0.0002, -0.0003, 0.0, 0.0, 0.0, 0.0, 0.0, 0.0, 0.0, 0.0, 0.0, 0.0, 0.0, 0.0, 0.0, 0.0, 0.0, 0.0, 0.0, 0.0, 0.0, 0.0, 0.0, 0.0, 0.0, 0.0, 0.0, 0.0, -0.0001, 0.0, 0.0, 0.0, 0.0, 0.0, 0.0, 0.0, 0.0, 0.0, 0.0, 0.0, 0.0, 0.0, 0.0, 0.0, 0.0, 0.0, 0.0, 0.0, 0.0, 0.0, 0.0, 0.0]","1, 0, 0, 0, 0, 0, 0, 0, 0, 0, 0, 0, 3, 0, 0, 0, 0, 0, 0, 0, 0, 0, 0, 0, 0, 0, 0, 0, 3, 0, 0, -9, 0, 0, 3, 0, 3, 0, 0, 0, 1, 0, 0, 0, 1, 0, 0, 0, 0, 0, 0, 0, 0, 0, 0, 0, 0, 0, 0, 0, 0, 0, 0, 0, 0, 0, 0, 0, 0, 0, 0, 0, 0, 0, 0, 0, 0, 0, 0, 0, 0, 0, 0, 0, 0, 0, 0, 0, 0",89
Draw,Draw,Stockfish,Stockfish,"e4d5, g8f6, d2d4, f6d5, g1f3, c8f5, f1d3, f5d3, d1d3, e7e6, c2c4, d5f6, b1c3, c7c6, e1g1, f8e7, c1f4, f6h5, f4e3, h5f6, f3e5, e8g8, f2f4, b8d7, d3e2, c6c5, a1d1, c5d4, e3d4, d8c8, e5d7, f6d7, f4f5, e6e5, c3d5, f8e8, d4f2, e7d8, b2b4, d7f6, d5f6, d8f6, e2e4, f6e7, b4b5, e7c5, d1d5, c5f2, f1f2, c8c7, c4c5, a8d8, f2d2, d8d5, d2d5, h7h6, h2h4, f7f6, a2a4, e8c8, g2g4, c7e7, e4e3, c8d8, d5d8, e7d8, e3b3, g8h7, b3c4, h6h5, g4g5, f6g5, f5f6, d8d1, c4f1, d1d4, f1f2, d4g4, g1h2, g7f6, c5c6, b7c6, b5c6, g4c4, h4g5, c4c6, g5f6, c6b6, f2f5, h7h6, f6f7, b6b2, h2h1, b2c1, h1g2, c1b2, g2g1, b2a1, g1g2, a1b2, g2f3, b2c3, f3e2, c3b2, e2f3, e5e4, f3g3, b2c3, g3h4, c3e1, h4h3, e1h1, h3g3, h1g1, g3h3, g1h1, h3g3, h1e1, g3h3, e1h1, h3g3, h5h4, g3f2, h1h2, f2f1, h2h1, f1f2, h1h2, f2e1, h2g3, e1d2, g3d3, d2c1, d3c3, c1d1, c3b3, d1c1, b3a3, c1d2, a3b4, d2d1, b4b3, d1c1, b3c4, c1d2, c4a2, d2c1, a2a3, c1d2, a3d6, d2e2, h6g7, f7f8q, d6f8, f5g5, g7f7, g5f5, f7e8, f5c8, e8f7, c8f5, f7e8, f5c8, e8e7, c8c5, e7f7, c5f5, f7e8, f5c8, e8e7, c8c5, e7e8, c5c8, e8e7, c8c5, e7f7, c5f5, f7g7, f5g5, g7f7, g5f5","[0.0063, 0.0068, 0.0067, 0.0068, 0.0079, 0.006, 0.0065, 0.0057, 0.0066, 0.0065, 0.0072, 0.0066, 0.0067, 0.0068, 0.0067, 0.006, 0.0069, 0.0071, 0.0065, 0.007, 0.0077, 0.008, 0.0069, 0.006, 0.0072, 0.0062, 0.0056, 0.0058, 0.0062, 0.0055, 0.0067, 0.0068, 0.0057, 0.0059, 0.0057, 0.0052, 0.0048, 0.0048, 0.007, 0.0054, 0.0046, 0.0046, 0.0037, 0.0039, 0.0037, 0.0035, 0.0027, 0.002, 0.0033, 0.0028, 0.0028, 0.0014, 0.0026, 0.0034, 0.0016, 0.0006, 0.0001, 0.0002, 0.0003, 0.0, 0.0003, 0.0012, 0.0, 0.0, 0.0, 0.0, 0.0, 0.0, 0.0, 0.0, 0.0, 0.0, 0.0, 0.0, 0.0, 0.0, 0.0, 0.0, 0.0, 0.0, 0.0, 0.0, 0.0, 0.0, 0.0, 0.0, 0.0, 0.0, 0.0, 0.0, 0.0, 0.0, 0.0, 0.0, 0.0, 0.0, 0.0, 0.0, 0.0, 0.0, 0.0, 0.0, 0.0, 0.0, 0.0, 0.0, 0.0, 0.0, 0.0, 0.0, 0.0, 0.0, 0.0, 0.0, 0.0, 0.0, 0.0, 0.0, 0.0, 0.0, 0.0, 0.0, 0.0, 0.0, 0.0, 0.0, 0.0, 0.0, 0.0, 0.0, 0.0, 0.0, 0.0, 0.0, 0.0, 0.0, 0.0, 0.0, 0.0, 0.0, 0.0, 0.0, 0.0, 0.0, 0.0, 0.0, 0.0, 0.0, 0.0, 0.0, 0.0, 0.0, 0.0, 0.0, 0.0, 0.0, 0.0, 0.0, 0.0, 0.0, 0.0, 0.0, 0.0, 0.0, 0.0, 0.0, 0.0, 0.0, 0.0, 0.0, 0.0, 0.0, 0.0, 0.0, 0.0, 0.0, 0.0, 0.0, 0.0, 0.0, 0.0]","1, 1, 1, 0, 0, 0, 0, -3, 0, 0, 0, 0, 0, 0, 0, 0, 0, 0, 0, 0, 0, 0, 0, 0, 0, 0, 0, -1, 0, 0, 3, 0, 0, 0, 0, 0, 0, 0, 0, 0, 3, 0, 0, 0, 0, 0, 0, -3, 0, 0, 0, 0, 0, -5, 0, 0, 0, 0, 0, 0, 0, 0, 0, 0, 5, 0, 0, 0, 0, 0, 0, -1, -1, -1, -1, -1, -1, -1, -1, -2, -2, -3, -2, -2, -1, -2, -1, -1, -1, -1, -1, -1, -1, -1, -1, -1, -1, -1, -1, -1, -1, -1, -1, -1, -1, -1, -1, -1, -1, -1, -1, -1, -1, -1, -1, -1, -1, -1, -1, -1, -1, -1, -1, -1, -1, -1, -1, -1, -1, -1, -1, -1, -1, -1, -1, -1, -1, -1, -1, -1, -1, -1, -1, -1, -1, -1, -1, -1, -1, -1, -1, -1, 7, -2, -2, -2, -2, -2, -2, -2, -2, -2, -2, -2, -2, -2, -2, -2, -2, -2, -2, -2, -2, -2, -2, -2, -2, -2, -2, -2, -2",181
Black,White,Stockfish,Stockfish,"f6e4, b1c3, e4f6, d1e2, d7d5, e2e5, c8e6, c4b3, c7c5, e5e2, f8e7, g1f3, b8c6, d2d3, e6g4, b3a4, e8g8, a4c6, b7c6, e1g1, e7d6, h2h3, g4h5, c1g5, h7h6, g5h4, f8e8, e2d1, a8b8, a1b1, e8e6, f1e1, e6e1, d1e1, h5f3, g2f3, g7g5, h4g3, f6h5, g1g2, d8f6, e1d2, d6f4, d2e1, g8h7, g2h2, h5g7, c3e2, b8e8, g3f4, g5f4, e1f1, g7f5, e2g1, f5h4, h2h1, a7a5, b2b3, f6g5, b1c1, e8a8, c2c4, a5a4, b3a4, a8a4, c1c2, g5g6, c2b2, a4a3, b2d2, a3a4, d2b2, a4a3, b2d2, a3a8, d2b2, a8a4, g1e2, g6d3, b2b3, d3f5, f1b1, f5b1, b3b1, a4a2, c4d5, c6d5, e2f4, d5d4, b1b7, h7g8, f4d3, c5c4, d3c5, c4c3, b7c7, a2f2, h1g1, f2d2, c5e4, h4f3, g1f1, f3h2, f1e1, h2f3, e1f1, d2c2, e4f2, f3d2, f1g1, d2f3, g1f1, g8g7, c7c8, f3d2, f1e1, d2f3, e1f1, f3e5, f2e4, c2c1, f1g2, c3c2, e4f2, d4d3, f2d3, e5d3, g2h2, d3b4, h2g3, c1g1, g3f3, c2c1q, c8c1, g1c1, f3g4, c1c3, h3h4, c3c4, g4f3, g7g6, h4h5, g6g5, f3g3, c4c3, g3f2, g5f4, f2e2, c3c2, e2f1, f4g3, f1e1, g3f3, e1d1, f3e3, d1e1, c2c1","[-0.0163, -0.0161, -0.0162, -0.0157, -0.0144, -0.0152, -0.0142, -0.0157, -0.0152, -0.0146, -0.0144, -0.0139, -0.0144, -0.0125, -0.0171, -0.0178, -0.0184, -0.0162, -0.0189, -0.0203, -0.0197, -0.0192, -0.0195, -0.0209, -0.0189, -0.0187, -0.0194, -0.0188, -0.0196, -0.0193, -0.0192, -0.0192, -0.0194, -0.0206, -0.0215, -0.0214, -0.0225, -0.0229, -0.0224, -0.0214, -0.0238, -0.0237, -0.0256, -0.0247, -0.0238, -0.0283, -0.0266, -0.0278, -0.0255, -0.0243, -0.0242, -0.0233, -0.0246, -0.026, -0.0256, -0.0273, -0.0253, -0.0249, -0.0256, -0.0257, -0.027, -0.0278, -0.0299, -0.0325, -0.0324, -0.0353, -0.0361, -0.0374, -0.0388, -0.0382, -0.0405, -0.0364, -0.0375, -0.0347, -0.0416, -0.0425, -0.0419, -0.0438, -0.0414, -0.0423, -0.0438, -0.0434, -0.0458, -0.0462, -0.0469, -0.0457, -0.0455, -0.0454, -0.0473, -0.0459, -0.045, -0.05, -0.0507, -0.0501, -0.0507, -0.0506, -0.0524, -0.0517, -0.0542, -0.0531, -0.0538, -0.0547, -0.0535, -0.053, -0.0542, -0.055, -0.0565, -0.0567, -0.0571, -0.0572, -0.0587, -0.0579, -0.0588, -0.0577, -0.0578, -0.0598, -0.0608, -0.0611, -0.0615, -0.0632, -0.065, -0.0645, -0.0657, -0.0655, -0.0658, -0.0671, -0.0669, -0.0698, -0.3564, -0.3577, -0.9979, -0.9981, -0.9983, -0.9986, -0.9987, -0.9988, -0.9989, -0.9989, -0.999, -0.9991, -0.9992, -0.9992, -0.9993, -0.9993, -0.9994, -0.9994, -0.9995, -0.9995, -0.9996, -0.9996, -0.9997, -0.9997, -0.9998, -0.9998, -0.9999, -0.9999, -1.0]","-1, -1, -1, -1, -1, 0, 0, 0, 0, 0, 0, 0, 0, 0, 0, 0, 0, 3, 0, 0, 0, 0, 0, 0, 0, 0, 0, 0, 0, 0, 0, 0, -5, 0, -3, 0, 0, 0, 0, 0, 0, 0, 0, 0, 0, 0, 0, 0, 0, 3, 0, 0, 0, 0, 0, 0, 0, 0, 0, 0, 0, 0, 0, 1, 0, 0, 0, 0, 0, 0, 0, 0, 0, 0, 0, 0, 0, 0, -1, -1, -1, -1, -10, -1, -2, -1, -2, -1, -1, -1, -1, -1, -1, -1, -1, -1, -2, -2, -2, -2, -3, -3, -3, -3, -3, -3, -3, -3, -3, -3, -3, -3, -3, -3, -3, -3, -3, -3, -3, -3, -3, -3, -3, -3, -3, -2, -5, -5, -5, -5, -5, -5, -13, -4, -9, -9, -9, -9, -9, -9, -9, -9, -9, -9, -9, -9, -9, -9, -9, -9, -9, -9, -9, -9, -9, -9, -9",157
Black,White,Stockfish,Stockfish,"f6e4, g1f3, d7d5, c4b3, b8c6, e1g1, c8g4, h2h3, g4h5, d2d3, e4c5, f1e1, c5b3, a2b3, f8e7, g2g4, h5g6, f3e5, c6e5, e1e5, e8g8, f2f4, e7d6, e5d5, c7c6, d5d6, d8d6, c1e3, f8e8, d1f3, g6d3, c2d3, d6d3, g1f2, d3b3, e3d4, b3c2, f2g3, c2c1, b2b4, a8d8, f3c3, c1c3, d4c3, d8d3, g3f2, a7a6, g4g5, e8e3, h3h4, e3f3, f2e2, f3e3, e2f2, e3h3, c3e1, h3f3, f2e2, d3e3, e2d2, f7f6, h4h5, f3h3, h5h6, e3e4, b1c3, e4f4, g5f6, g7f6, d2e2, f4b4, e1d2, b4g4, c3d1, g4e4, e2f2, f6f5, d1e3, h3h6, d2a5, h6h2, f2g3, h2b2, e3f5, b2b3, g3g2, e4e2, g2g1, c6c5, a5e1, b3d3, a1c1, b7b5, g1f1, e2e4, f1f2, c5c4, f5g3, e4f4, f2e2, f4f6, g3h1, f6e6, e2f2, h7h5, f2g2, d3e3, e1b4, e6g6, g2h2, h5h4, b4c5, e3e2, h2h3, g8f7, c5f2, f7e6, f2c5, a6a5, c5f2, e2e4, f2b6, a5a4, b6c7, e6d7, c7b8, d7c8, b8a7, c8b7, a7g1, c4c3, g1c5, e4c4, c5e7, c3c2, h1f2, g6e6, e7g5, a4a3, f2d3, c4c3, h3g4, c3d3, c1c2, e6e4, g4h5, d3d5, h5h6, e4e6, h6h5, e6e5, h5h4, e5g5, c2c3, b5b4, c3c4, d5b5, c4c2, b7b6, h4h3, b5d5, c2c4, b6b5, c4c7, b5a4, c7a7, a4b3, a7e7, g5e5, e7f7, e5h5, h3g2, d5g5, g2f3, g5f5, f7f5, h5f5, f3e4, f5a5, e4d3, a3a2, d3e4, a2a1q, e4e3, a1f6, e3d2, f6c3, d2e2, a5a2, e2d1, c3a1","[-0.0173, -0.0164, -0.0176, -0.0158, -0.0175, -0.0165, -0.0201, -0.0187, -0.0177, -0.0174, -0.0193, -0.0199, -0.0184, -0.0185, -0.0189, -0.0188, -0.0194, -0.018, -0.0208, -0.0182, -0.0188, -0.0199, -0.021, -0.0192, -0.0204, -0.0203, -0.0207, -0.0217, -0.023, -0.0266, -0.0253, -0.0275, -0.0254, -0.0264, -0.0265, -0.0297, -0.0295, -0.0296, -0.0314, -0.0305, -0.0324, -0.0318, -0.0325, -0.0332, -0.0295, -0.032, -0.0321, -0.033, -0.035, -0.0353, -0.0345, -0.0351, -0.035, -0.0351, -0.0355, -0.035, -0.0342, -0.0336, -0.0335, -0.0339, -0.0329, -0.033, -0.0353, -0.0368, -0.0371, -0.0365, -0.0377, -0.0385, -0.0391, -0.0392, -0.0372, -0.0395, -0.0389, -0.0387, -0.0409, -0.0408, -0.043, -0.04, -0.0393, -0.0397, -0.0397, -0.0421, -0.0438, -0.0444, -0.0432, -0.0451, -0.0423, -0.0453, -0.0464, -0.045, -0.0459, -0.045, -0.0465, -0.0478, -0.0468, -0.0461, -0.0489, -0.0489, -0.0484, -0.048, -0.0488, -0.0476, -0.0473, -0.0479, -0.0474, -0.0483, -0.0493, -0.0503, -0.0493, -0.0511, -0.0502, -0.051, -0.0503, -0.052, -0.0517, -0.0526, -0.0526, -0.0547, -0.0526, -0.0558, -0.0554, -0.0558, -0.057, -0.058, -0.0599, -0.0613, -0.0582, -0.0613, -0.0625, -0.0629, -0.0642, -0.0646, -0.0644, -0.066, -0.0675, -0.0672, -0.0683, -0.0683, -0.0694, -0.072, -0.0787, -0.0792, -0.0815, -0.0823, -0.0831, -0.0849, -0.0875, -0.0869, -0.0892, -0.0913, -0.093, -0.093, -0.0939, -0.0939, -0.0947, -0.095, -0.0965, -0.0969, -0.0975, -0.1002, -0.1013, -0.105, -0.1089, -0.1348, -0.1335, -0.3622, -0.3657, -0.4022, -0.4022, -0.9959, -0.999, -0.999, -0.9991, -0.9991, -0.9992, -0.9992, -0.9993, -0.9993, -0.9994, -0.9994, -0.9995, -0.9995, -0.9996, -0.9996, -0.9997, -0.9997, -0.9998, -0.9998, -0.9999, -0.9999, -1.0]","-1, -1, -1, -1, -1, -1, -1, -1, -1, -1, -1, -1, -4, -1, -1, -1, -1, 0, -3, 0, 0, 0, 0, 1, 1, 4, -1, -1, -1, -1, -2, 1, 0, 0, -1, -1, -1, -1, -1, -1, -1, -1, -10, -1, -1, -1, -1, -1, -1, -1, -1, -1, -1, -1, -1, -1, -1, -1, -1, -1, -1, -1, -1, -1, -1, -1, -2, -1, -2, -2, -3, -3, -3, -3, -3, -3, -3, -3, -4, -4, -4, -4, -4, -3, -3, -3, -3, -3, -3, -3, -3, -3, -3, -3, -3, -3, -3, -3, -3, -3, -3, -3, -3, -3, -3, -3, -3, -3, -3, -3, -3, -3, -3, -3, -3, -3, -3, -3, -3, -3, -3, -3, -3, -3, -3, -3, -3, -3, -3, -3, -3, -3, -3, -3, -3, -3, -3, -3, -3, -3, -3, -3, -6, -5, -5, -5, -5, -5, -5, -5, -5, -4, -7, -7, -7, -7, -7, -7, -7, -7, -7, -7, -7, -7, -7, -7, -7, -7, -7, -7, -7, -7, -7, -7, -7, -2, -7, -7, -7, -7, -7, -7, -15, -15, -15, -15, -15, -15, -15, -15, -15",191
Black,White,Stockfish,Stockfish,"f6e4, b1c3, e4f6, d1e2, d7d5, e2e5, c8e6, c4b3, b8c6, e5e2, f8c5, c3a4, c5e7, c2c3, e6g4, f2f3, g4f5, g2g4, f5d7, d2d4, e8g8, e2g2, c6a5, g1e2, d8e8, a4c5, d7b5, g4g5, f6d7, c5d7, e8d7, b3c2, e7d6, e1g1, a8e8, f1e1, e8e2, e1e2, b5e2, g2e2, f8e8, e2f1, c7c5, d4c5, d6c5, g1h1, a5c4, c1f4, c4b2, a1e1, e8e1, f1e1, b2c4, e1e2, d7h3, c2d3, g7g6, a2a4, b7b6, f4g3, c4e3, g3f4, e3c4, f4g3, h3d7, d3c4, d5c4, e2c4, d7d1, h1g2, d1d2, g2f1, d2d1, f1g2, d1d2, g2f1, d2g5, c4e4, g5d8, f1e1, c5f8, g3e5, d8e7, e1e2, h7h5, e5f4, e7c5, e4d4, c5c6, f4e5, f8e7, d4e4, c6e4, f3e4, g8f8, e2d3, f8e8, h2h3, e8d7, c3c4, e7d6, e5c3, d7e6, d3e2, g6g5, e2e3, f7f6, e3f2, f6f5, e4f5, e6f5, f2e3, g5g4, h3g4, h5g4, a4a5, d6c5, e3e2, f5e4, a5b6, c5b6, c4c5, b6c5, c3e1, e4d4, e1a5, c5d6, a5d8, d4c4, e2f1, c4b5, d8f6, a7a5, f1f2, a5a4, f6b2, b5b4, f2e3, a4a3, b2g7, b4c4, g7a1, c4d5, a1f6, d6e5, f6h4, a3a2, h4e1, a2a1q, e1f2, a1c3, e3e2, d5e4, e2f1, e4f3, f2h4, c3a1, h4e1, a1d1, f1g1, d1e1","[-0.0158, -0.0144, -0.0167, -0.0145, -0.0151, -0.0156, -0.0157, -0.0149, -0.016, -0.0147, -0.0134, -0.0162, -0.0146, -0.0154, -0.0154, -0.016, -0.0162, -0.0169, -0.0166, -0.0154, -0.0159, -0.0145, -0.0152, -0.0161, -0.0154, -0.0172, -0.0176, -0.018, -0.0183, -0.0177, -0.0189, -0.0179, -0.0181, -0.0187, -0.0195, -0.0183, -0.0189, -0.0164, -0.0192, -0.0194, -0.0205, -0.0191, -0.0191, -0.0208, -0.0203, -0.018, -0.0195, -0.0203, -0.0189, -0.0211, -0.0213, -0.0214, -0.0216, -0.02, -0.0222, -0.02, -0.0203, -0.0234, -0.0257, -0.0229, -0.0243, -0.0222, -0.0219, -0.0217, -0.0215, -0.0217, -0.0214, -0.0209, -0.0214, -0.0215, -0.0197, -0.0203, -0.0205, -0.0201, -0.0194, -0.0196, -0.0206, -0.0208, -0.0219, -0.0192, -0.0206, -0.0207, -0.0206, -0.021, -0.0224, -0.0233, -0.0246, -0.0268, -0.028, -0.0283, -0.0287, -0.0285, -0.0297, -0.0289, -0.0291, -0.031, -0.0328, -0.033, -0.0343, -0.0334, -0.0364, -0.0367, -0.0398, -0.0396, -0.0403, -0.0428, -0.0419, -0.0455, -0.0472, -0.0478, -0.0529, -0.054, -0.053, -0.0568, -0.0591, -0.0624, -0.061, -0.0676, -0.0605, -0.0667, -0.067, -0.0682, -0.0697, -0.0679, -0.073, -0.0735, -0.0768, -0.0814, -0.0871, -0.0953, -0.1066, -0.3538, -0.3579, -0.3587, -0.3521, -0.3771, -0.379, -0.3852, -0.39, -0.4541, -0.9605, -0.9975, -0.9986, -0.9989, -0.9991, -0.9991, -0.9993, -0.9993, -0.9994, -0.9994, -0.9995, -0.9995, -0.9996, -0.9996, -0.9997, -0.9997, -0.9998, -0.9998, -0.9999, -0.9999, -1.0]","-1, -1, -1, -1, -1, 0, 0, 0, 0, 0, 0, 0, 0, 0, 0, 0, 0, 0, 0, 0, 0, 0, 0, 0, 0, 0, 0, 0, 0, 3, 0, 0, 0, 0, 0, 0, -3, 2, -3, 0, 0, 0, 0, 1, 0, 0, 0, 0, -1, -1, -6, -1, -1, -1, -1, -1, -1, -1, -1, -1, -1, -1, -1, -1, -1, 2, -1, 0, 0, 0, 0, 0, 0, 0, 0, 0, -1, -1, -1, -1, -1, -1, -1, -1, -1, -1, -1, -1, -1, -1, -1, -1, -10, -1, -1, -1, -1, -1, -1, -1, -1, -1, -1, -1, -1, -1, -1, -1, -1, 0, -1, -1, -1, 0, -1, -1, -1, -1, -1, 0, -1, -1, -2, -2, -2, -2, -2, -2, -2, -2, -2, -2, -2, -2, -2, -2, -2, -2, -2, -2, -2, -2, -2, -2, -2, -2, -2, -2, -10, -10, -10, -10, -10, -10, -10, -10, -10, -10, -10, -10, -13",161
