winner,loser,white_pieces,black_pieces,moves,evaluations,material_advantage,move_count
White,Black,Stockfish,Stockfish,"c7c5, f1e2, g8f6, g1f3, b8c6, h2h3, e6e5, c2c3, h7h6, c1e3, c8e6, b1d2, f8d6, a2a3, e8g8, b2b4, d8e7, e1g1, b7b6, b4b5, c6a5, f1e1, c5c4, d3d4, e5d4, c3d4, c4c3, e4e5, c3d2, e3d2, a5b3, e5d6, e7d8, d4d5, e6d5, d2c3, b3a1, c3f6, d8f6, d1d5, a8e8, d6d7, e8e6, e2c4, e6e1, f3e1, f6g5, d5e4, g5d8, e4d5, d8g5, d5e4, g5d8, c4d3, g7g6, d3c4, g8g7, e1f3, d8d7, e4e5, g7h7, e5a1, d7f5, a1d4, f8e8, c4d3, f5c8, h3h4, c8c1, g1h2, c1c5, d4c5, b6c5, a3a4, h7g7, a4a5, g7f6, g2g4, e8d8, d3e2, g6g5, h4g5, h6g5, h2g3, d8e8, e2d3, e8e7, a5a6, e7d7, d3e2, d7e7, e2c4, e7d7, g3h2, d7d8, h2g1, d8d1, g1g2, d1b1, f3d2, b1b4, g2f3, f6e5, f3e3, f7f5, g4f5, e5f5, d2e4, g5g4, e3d3, f5e5, e4c5, e5d6, c5e4, d6e5, e4d2, b4a4, d3c3, a4a3, c3b4, a3a1, d2b3, a1h1, b5b6, a7b6, a6a7, h1h8, b4b5, h8c8, b5b6, e5f4, c4d5, c8d8, d5c6, f4g5, b3c5, d8g8, a7a8q, g8a8, c6a8, g5h4, c5d3, h4h3, b6c5, h3h4, c5d4, h4h5, a8e4, h5g5, d4e5, g5h5, e5f5, h5h4, f5f6, g4g3, f2f4, g3g2, e4g2, h4g3, g2e4, g3h2, f4f5, h2g1, f6e5, g1f1, f5f6, f1e2, f6f7, e2d1, f7f8q, d1c2, f8f2, c2b3, f2b2, b3c4, b2b4","[0.014, 0.0145, 0.0144, 0.0145, 0.0139, 0.0142, 0.0143, 0.0148, 0.0134, 0.0136, 0.0146, 0.0135, 0.0136, 0.0137, 0.0138, 0.0148, 0.0148, 0.0148, 0.0147, 0.0145, 0.0151, 0.0127, 0.0131, 0.0138, 0.0143, 0.0146, 0.0171, 0.0173, 0.0157, 0.0178, 0.0207, 0.0222, 0.0191, 0.0201, 0.0208, 0.0208, 0.0186, 0.0194, 0.0207, 0.0218, 0.022, 0.0227, 0.0219, 0.0219, 0.0217, 0.0232, 0.0232, 0.0223, 0.0239, 0.0242, 0.0236, 0.0232, 0.0217, 0.022, 0.0239, 0.0236, 0.0238, 0.0225, 0.0221, 0.0217, 0.0225, 0.0222, 0.0239, 0.0242, 0.0229, 0.0235, 0.0207, 0.0228, 0.0265, 0.0264, 0.0256, 0.0249, 0.0235, 0.0261, 0.0271, 0.0271, 0.0283, 0.0277, 0.0264, 0.0256, 0.027, 0.0288, 0.0321, 0.0325, 0.031, 0.0313, 0.0326, 0.0338, 0.0318, 0.0336, 0.0356, 0.035, 0.0339, 0.0343, 0.0349, 0.036, 0.0349, 0.0346, 0.036, 0.0371, 0.0362, 0.0371, 0.0382, 0.0378, 0.0395, 0.0389, 0.0406, 0.04, 0.0411, 0.0403, 0.0408, 0.0416, 0.0427, 0.0417, 0.0426, 0.0437, 0.0433, 0.0432, 0.0425, 0.0474, 0.0476, 0.0478, 0.0479, 0.0496, 0.05, 0.0503, 0.05, 0.0503, 0.0531, 0.0542, 0.0532, 0.0583, 0.0598, 0.0624, 0.065, 0.0811, 0.1051, 0.3376, 0.3385, 0.3592, 0.3815, 0.4074, 0.997, 0.9972, 0.9974, 0.9976, 0.9976, 0.9977, 0.9982, 0.9984, 0.9985, 0.9986, 0.9986, 0.9988, 0.9988, 0.9989, 0.9989, 0.9991, 0.9991, 0.9992, 0.9992, 0.9993, 0.9993, 0.9994, 0.9994, 0.9995, 0.9995, 0.9996, 0.9996, 0.9997, 0.9997, 0.9998, 0.9998, 0.9999, 0.9999, 1.0]","1, 1, 1, 1, 1, 1, 1, 1, 1, 1, 1, 1, 1, 1, 1, 1, 1, 1, 1, 1, 1, 1, 1, 1, 0, 1, 1, 1, -2, -1, -1, 2, 2, 2, 1, 1, -4, -1, -4, -1, -1, -1, -1, -1, -6, -1, -1, -1, -1, -1, -1, -1, -1, -1, -1, -1, -1, -1, -2, -2, -2, 1, 1, 1, 1, 1, 1, 1, 1, 1, 1, 10, 1, 1, 1, 1, 1, 1, 1, 1, 1, 2, 1, 1, 1, 1, 1, 1, 1, 1, 1, 1, 1, 1, 1, 1, 1, 1, 1, 1, 1, 1, 1, 1, 1, 2, 1, 1, 1, 1, 1, 2, 2, 2, 2, 2, 2, 2, 2, 2, 2, 2, 2, 2, 1, 1, 1, 1, 1, 2, 2, 2, 2, 2, 2, 2, 2, 10, 1, 6, 6, 6, 6, 6, 6, 6, 6, 6, 6, 6, 6, 6, 6, 6, 6, 6, 6, 7, 7, 7, 7, 7, 7, 7, 7, 7, 7, 7, 7, 15, 15, 15, 15, 15, 15, 15",176
White,Black,Stockfish,Stockfish,"e4d5, g8f6, d2d4, f6d5, g1f3, c8f5, f1d3, f5d3, d1d3, c7c6, c2c4, d5f6, e1g1, e7e6, b1c3, f8e7, c1f4, b8d7, a1d1, e8g8, f1e1, f8e8, f4g3, d7f8, f3e5, f6d7, e5f3, d7f6, h2h3, f8g6, a2a3, d8a5, c4c5, a5d8, d3c2, d8c8, f3d2, e8d8, d2c4, d8d7, a3a4, c8d8, c2b3, b7b6, c5b6, a7b6, b3b6, d8c8, b6b3, c8a6, a4a5, d7b7, b3a2, f6d5, c3a4, a6a7, a4c5, e7c5, d4c5, a7c5, d1c1, d5f4, e1e4, c5g5, c1e1, f4h5, a2a3, h5g3, f2g3, h7h5, e1d1, b7b5, e4d4, h5h4, g3g4, g6e5, c4e5, g5e5, b2b4, b5d5, a3a1, e5e3, g1h1, a8d8, d4d5, e6d5, d1e1, e3g3, a5a6, d8a8, e1c1, g3d6, g4g5, g7g6, a1a4, d6e6, a4c6, a8a6, c6c7, e6e8, c1b1, d5d4, b4b5, a6a2, b5b6, e8e4, b1g1, a2b2, c7d6, g8h7, h1h2, h7g8, h2h1, g8g7, h1h2, b2c2, b6b7, e4b7, d6d4, g7g8, d4h4, c2b2, h4f4, b7d5, h2h1, b2b3, f4h4, d5d8, g1e1, b3d3, h4c4, d3d2, e1f1, d8e7, f1f3, e7b7, c4f4, b7d5, h1h2, d2d3, f3d3, d5d3, f4f3, d3d6, f3g3, d6d4, h3h4, g8g7, h2h3, d4d7, g3g4, d7d3, g4f3, d3c4, f3f6, g7g8, f6e5, c4c8, h3g3, c8c4, e5e8, g8g7, e8e5, g7g8, e5e8, g8g7, e8e7, c4d3, g3g4, d3c4, g4g3, c4d3, g3h2, d3d4, h2h3, d4d3, h3h2, d3d4, e7e1, g7g8, g2g3, d4b2, h2g1, b2d4, g1f1, d4d3, f1f2, d3c2, f2f1, c2f5, f1g1, f5c5, e1f2, c5c1, g1g2, c1c6, f2f3, c6c2, f3f2, c2e4, f2f3, e4c2, f3f2, c2e4, g2h2, e4c4, f2d2, c4f1, d2b2, f1f3, b2b8, g8g7, b8e5, g7h7, e5e1, h7g8, e1e8, g8g7, e8e5, g7h7, e5f4, f3e2, h2g1, h7g7, f4d4, g7g8, d4c3, g8h7, c3d4, h7g8, d4d5, e2e1, g1h2, e1f2, d5g2, f2e3, g2a8, g8h7, a8g2, h7g7, g2f1, e3d2, f1g2, d2d4, g2e2, d4d5, e2e1, d5f3, h2g1, f3d3, g1g2, d3d5, g2f1, d5d3, f1g2, d3d5, g2h2, d5a2, h2g1, a2c4, e1e5, g7h7, g1f2, c4c2, f2e3, c2c1, e3f2, c1c2, f2e1, c2c1, e1e2, c1c2, e2f3, c2b3, f3f4, b3c4, e5e4, c4c5, f4f3, c5c3, f3g2, c3f3, g2f3, h7g7, e4e8, f7f5, e8e7, g7h8, f3f4, h8g8, f4e5, f5f4, e5f6, f4f3, e7g7","[0.0057, 0.0075, 0.0069, 0.0066, 0.0068, 0.0067, 0.0073, 0.0063, 0.0065, 0.0067, 0.007, 0.007, 0.0072, 0.007, 0.0065, 0.0066, 0.0067, 0.0072, 0.0074, 0.0068, 0.0068, 0.0063, 0.0067, 0.0066, 0.0064, 0.0071, 0.0065, 0.0067, 0.0068, 0.0072, 0.0078, 0.0076, 0.0076, 0.0063, 0.0068, 0.006, 0.007, 0.006, 0.0058, 0.005, 0.0061, 0.0048, 0.0054, 0.0066, 0.0043, 0.0051, 0.0052, 0.0044, 0.0054, 0.0042, 0.0054, 0.0049, 0.0045, 0.0041, 0.0043, 0.0042, 0.0046, 0.004, 0.0036, 0.0041, 0.0034, 0.0048, 0.0039, 0.0048, 0.0048, 0.0047, 0.0048, 0.0036, 0.005, 0.0037, 0.0051, 0.005, 0.0032, 0.0032, 0.0035, 0.003, 0.0025, 0.0027, 0.0017, 0.0013, 0.0015, 0.0003, 0.0014, 0.0007, 0.0005, 0.0003, 0.0001, 0.0001, 0.0002, 0.0001, 0.0, 0.0, 0.0, 0.0, 0.0, 0.0, 0.0, 0.0, 0.0, 0.0, 0.0, 0.0, 0.0, 0.0, 0.0, 0.0, 0.0, 0.0, 0.0, 0.0, 0.0, 0.0, 0.0, 0.0, 0.0, 0.0, 0.0, 0.0, 0.0, 0.0, 0.0, 0.0, 0.0, 0.0, 0.0, 0.0, 0.0, 0.0, 0.0, 0.0, 0.0, 0.0001, 0.0, 0.0002, 0.0001, 0.0, 0.0, 0.0003, 0.0003, 0.0002, 0.0, 0.0, 0.0, 0.0, 0.0, 0.0, 0.0, 0.0, 0.0, 0.0, 0.0, 0.0, 0.0, 0.0, 0.0, 0.0, 0.0, 0.0, 0.0, 0.0, 0.0, 0.0, 0.0, 0.0, 0.0, 0.0, 0.0, 0.0, 0.0, 0.0, 0.0, 0.0, 0.0, 0.0, 0.0, 0.0, 0.0, 0.0, 0.0, 0.0, 0.0, 0.0, 0.0, 0.0, 0.0, 0.0, 0.0, 0.0, 0.0, 0.0, 0.0, 0.0, 0.0, 0.0, 0.0, 0.0, 0.0, 0.0, 0.0, 0.0, 0.0, 0.0, 0.0, 0.0, 0.0, 0.0, 0.0, 0.0, 0.0, 0.0, 0.0, 0.0, 0.0, 0.0, 0.0, 0.0, 0.0, 0.0, 0.0, 0.0, 0.0, 0.0, 0.0, 0.0, 0.0, 0.0, 0.0, 0.0, 0.0, 0.0, 0.0, 0.0, 0.0, 0.0, 0.0, 0.0, 0.0, 0.0, 0.0, 0.0, 0.0, 0.0, 0.0, 0.0, 0.0, 0.0, 0.0, 0.0, 0.0, 0.0, 0.0, 0.0, 0.0, 0.0, 0.0, 0.0, 0.0, 0.0, 0.0, 0.0, 0.0, 0.0, 0.0, 0.0, 0.0, 0.0, 0.0, 0.0, 0.0, 0.0, 0.0, 0.0, 0.0, 0.0, 0.0, 0.0, 0.0, 0.0, 0.0, 0.0, 0.0, 0.9993, 0.9994, 0.9994, 0.9995, 0.9995, 0.9996, 0.9996, 0.9997, 0.9997, 0.9998, 0.9998, 0.9999, 0.9999, 1.0]","1, 1, 1, 0, 0, 0, 0, -3, 0, 0, 0, 0, 0, 0, 0, 0, 0, 0, 0, 0, 0, 0, 0, 0, 0, 0, 0, 0, 0, 0, 0, 0, 0, 0, 0, 0, 0, 0, 0, 0, 0, 0, 0, 0, 1, 0, 1, 1, 1, 1, 1, 1, 1, 1, 1, 1, 1, -2, 1, 0, 0, 0, 0, 0, 0, 0, 0, -3, 0, 0, 0, 0, 0, 0, 0, 0, 3, 0, 0, 0, 0, 0, 0, 0, 5, 0, 0, 0, 0, 0, 0, 0, 0, 0, 0, 0, 1, 0, 0, 0, 0, 0, 0, 0, 0, 0, 0, 0, 0, 0, 0, 0, 0, 0, 0, 0, 0, -1, 0, 0, 1, 1, 1, 1, 1, 1, 1, 1, 1, 1, 1, 1, 1, 1, 1, 1, 1, 1, 1, 1, 6, 1, 1, 1, 1, 1, 1, 1, 1, 1, 1, 1, 1, 1, 1, 1, 1, 1, 1, 1, 1, 1, 1, 1, 1, 1, 1, 1, 1, 1, 1, 1, 1, 1, 1, 1, 1, 1, 1, 1, 1, 1, 1, 1, 1, 1, 1, 1, 1, 1, 1, 1, 1, 1, 1, 1, 1, 1, 1, 1, 1, 1, 1, 1, 1, 1, 1, 1, 1, 1, 1, 1, 1, 1, 1, 1, 1, 1, 1, 1, 1, 1, 1, 1, 1, 1, 1, 1, 1, 1, 1, 1, 1, 1, 1, 1, 1, 1, 1, 1, 1, 1, 1, 1, 1, 1, 1, 1, 1, 1, 1, 1, 1, 1, 1, 1, 1, 1, 1, 1, 1, 1, 1, 1, 1, 1, 1, 1, 1, 1, 1, 1, 1, 1, 1, 1, 1, 1, 1, 1, 1, 1, 10, 10, 10, 10, 10, 10, 10, 10, 10, 10, 10, 10, 10",295
Draw,Draw,Stockfish,Stockfish,"e4d5, g8f6, g1f3, d8d5, b1c3, d5a5, d2d4, c7c6, f1c4, c8f5, f3e5, e7e6, g2g4, f5g6, h2h4, b8d7, e5d7, f6d7, h4h5, g6e4, e1g1, e4d5, c3d5, c6d5, c4d3, g7g6, a2a4, f8d6, c1d2, a5d8, f2f4, d8h4, g1g2, d7f6, f1h1, h4g4, d1g4, f6g4, h5g6, f7g6, d3g6, e8d7, g6h7, a8f8, a1f1, g4f6, h7d3, f6h5, h1h4, d6e7, h4g4, f8g8, g2f3, g8g4, f3g4, h5g7, d2e1, h8g8, g4f3, g8h8, f3g4, h8g8, d3h7, g8h8, h7g6, h8g8, g4f3, g8h8, f3g4, h8g8, g4f3, g8h8, e1f2, g7f5, f1g1, e7f6, g6f5, e6f5, c2c3, h8h3, f2g3, a7a6, f3f2, f6d8, f2e2, d8f6, e2f1, h3h6, f1e2, f6e7, e2d1, b7b5, a4b5, a6b5, d1e2, b5b4, g1a1, b4c3, b2c3, e7d6, a1a7, d7e6, a7a6, e6e7, a6a7, e7e6, a7a1, e6d7, e2f2, h6h8, f2f3, d7e6, a1a6, e6d7, a6a7, d7e6, a7a6, h8h1, f3e2, h1h8, g3e1, h8h2, e2f3, h2h3, e1g3, h3h1, f3e2, h1h3, g3e1, h3h2, e2e3, e6d7, a6a7, d7e6, a7a6, e6d7, e1d2, h2h3, e3e2, h3h2, e2d1, h2h4, a6a7, d7e6, a7a6, e6d7, a6a7, d7e6, d1e2, d6f4, d2f4, h4f4, a7a6, e6d7, a6a7, d7d6, a7h7, f4e4, e2f3, e4e1, h7h6, d6d7, h6h7, d7d6, h7h6, d6d7, f3f4, e1c1, f4f5, c1c3, h6h7, d7d6, h7h6, d6d7, f5e5, c3g3, h6h7, d7c6, h7h6, c6d7, h6d6, d7c7, d6f6, g3g1, e5d5, g1a1, f6f7, c7d8, d5e5, a1b1, e5d6, b1b6, d6e5, b6b1, f7h7, b1a1, h7b7, a1a5, e5d6, a5a6, d6d5, a6a1, d5c6, a1a6, c6d5, a6a1, d5c6, a1a6, b7b6, a6a1, b6b8, d8e7, b8b7, e7d8, c6d6, a1a6, d6e5, a6a1, e5d5, a1a5, d5e6, a5a1, b7h7, a1a6, e6e5, a6a1, d4d5, a1a6, h7h8, d8c7, h8h7, c7d8, h7g7, a6h6, g7f7, h6g6, d5d6, g6g4, f7f8, d8d7, f8f7, d7e8, d6d7, e8d8, e5d6, g4g6, d6c5, g6g5, c5c4, g5g1, c4d5, g1g5, d5c4, g5g1, c4d5, g1d1, d5e6, d8c7, f7h7, d1e1, e6d5, e1d1, d5c4, d1c1, c4d4, c1d1, d4c5, d1d7, h7d7, c7d7","[0.0073, 0.0066, 0.0068, 0.006, 0.0074, 0.0067, 0.0071, 0.0073, 0.007, 0.0071, 0.0065, 0.0053, 0.0055, 0.0072, 0.006, 0.0059, 0.0067, 0.0054, 0.0058, 0.0053, 0.0058, 0.0063, 0.0065, 0.0062, 0.0066, 0.006, 0.0063, 0.0056, 0.0049, 0.005, 0.0058, 0.0063, 0.005, 0.0061, 0.0057, 0.0065, 0.0059, 0.0049, 0.0049, 0.0046, 0.0037, 0.0037, 0.0039, 0.0046, 0.0041, 0.0052, 0.0043, 0.0034, 0.0027, 0.003, 0.0046, 0.0034, 0.0037, 0.0041, 0.0043, 0.0033, 0.0038, 0.0032, 0.004, 0.0034, 0.0031, 0.0043, 0.0039, 0.0033, 0.0028, 0.0025, 0.0026, 0.0023, 0.0026, 0.0024, 0.0022, 0.0027, 0.0017, 0.0014, 0.0014, 0.001, 0.0008, 0.0013, 0.0013, 0.0017, 0.0014, 0.0011, 0.001, 0.0011, 0.0012, 0.0014, 0.0013, 0.0013, 0.001, 0.0007, 0.001, 0.0002, 0.0, 0.0001, 0.0, 0.0, 0.0, 0.0, 0.0, 0.0, 0.0, 0.0, 0.0, 0.0, 0.0, 0.0, 0.0, 0.0, 0.0, 0.0, 0.0, 0.0, 0.0, 0.0, 0.0, 0.0, 0.0, 0.0, 0.0, 0.0, 0.0, 0.0, 0.0, 0.0, 0.0, 0.0, 0.0, 0.0, 0.0, 0.0, 0.0, 0.0, 0.0, 0.0, 0.0, 0.0, 0.0, 0.0, 0.0, 0.0, 0.0, 0.0, 0.0, 0.0, 0.0, 0.0, 0.0, 0.0, 0.0, 0.0, 0.0, 0.0, 0.0, 0.0, 0.0, 0.0, 0.0, 0.0, 0.0, 0.0, 0.0, 0.0, 0.0, 0.0, 0.0, 0.0, 0.0, 0.0, 0.0, 0.0, 0.0, 0.0, 0.0, 0.0, 0.0, 0.0, 0.0, 0.0, 0.0, 0.0, 0.0, 0.0, 0.0, 0.0, 0.0, 0.0, 0.0, 0.0, 0.0, 0.0, 0.0, 0.0, 0.0, 0.0, 0.0, 0.0, 0.0, 0.0, 0.0, 0.0, 0.0, 0.0, 0.0, 0.0, 0.0, 0.0, 0.0, 0.0, 0.0, 0.0, 0.0, 0.0, 0.0, 0.0, 0.0, 0.0, 0.0, 0.0, 0.0, 0.0, 0.0, 0.0, 0.0, 0.0, 0.0, 0.0, 0.0, 0.0, 0.0, 0.0, 0.0, 0.0, 0.0, 0.0, 0.0, 0.0, 0.0, 0.0, 0.0, 0.0, 0.0, 0.0, 0.0, 0.0, 0.0, 0.0, 0.0, 0.0, 0.0, 0.0, 0.0, 0.0, 0.0, 0.0, 0.0, 0.0, 0.0, 0.0, 0.0, 0.0, 0.0, 0.0, 0.0, 0.0, 0.0, 0.0, 0.0, 0.0, 0.0, 0.0]","1, 1, 1, 0, 0, 0, 0, 0, 0, 0, 0, 0, 0, 0, 0, 0, 3, 0, 0, 0, 0, 0, 3, 0, 0, 0, 0, 0, 0, 0, 0, 0, 0, 0, 0, -1, 8, -1, 0, -1, 0, 0, 1, 1, 1, 1, 1, 1, 1, 1, 1, 1, 1, -4, 1, 1, 1, 1, 1, 1, 1, 1, 1, 1, 1, 1, 1, 1, 1, 1, 1, 1, 1, 1, 1, 1, 4, 1, 1, 1, 1, 1, 1, 1, 1, 1, 1, 1, 1, 1, 1, 1, 2, 1, 1, 1, 1, 0, 1, 1, 1, 1, 1, 1, 1, 1, 1, 1, 1, 1, 1, 1, 1, 1, 1, 1, 1, 1, 1, 1, 1, 1, 1, 1, 1, 1, 1, 1, 1, 1, 1, 1, 1, 1, 1, 1, 1, 1, 1, 1, 1, 1, 1, 1, 1, 1, 1, 1, 1, 0, 3, 0, 0, 0, 0, 0, 0, 0, 0, 0, 0, 0, 0, 0, 0, 0, 0, 0, 1, 0, 0, 0, 0, 0, 0, 0, 0, 0, 0, 0, 0, 0, 0, 0, 1, 1, 1, 1, 1, 1, 1, 1, 1, 1, 1, 1, 1, 1, 1, 1, 1, 1, 1, 1, 1, 1, 1, 1, 1, 1, 1, 1, 1, 1, 1, 1, 1, 1, 1, 1, 1, 1, 1, 1, 1, 1, 1, 1, 1, 1, 1, 1, 1, 1, 1, 1, 1, 1, 1, 1, 1, 1, 1, 1, 1, 1, 1, 1, 1, 1, 1, 1, 1, 1, 1, 1, 1, 1, 1, 1, 1, 1, 1, 1, 1, 1, 1, 0, 5, 0",270
Draw,Draw,Stockfish,Stockfish,"g8f6, b1c3, d6d5, e4e5, f6d7, f2f4, c7c5, g1f3, b8c6, c1e3, a7a6, d1d2, b7b5, h2h4, d8a5, g2g4, h7h5, g4h5, h8h5, h1h3, a8b8, b2b3, f8e7, c3e2, a5d2, e1d2, e8f8, a1d1, b5b4, d4c5, d7c5, e2g3, h5h8, h4h5, a6a5, d2c1, a5a4, c1b1, b8a8, f1b5, c6a7, b5e2, a7c6, d1h1, c8b7, h5h6, g7g6, h1g1, b7a6, e2a6, a8a6, h6h7, f8e8, f3d4, c5d7, g3e2, d7c5, d4c6, a6c6, e2d4, c6c8, d4b5, c5e4, b3a4, e4c3, b1a1, e8d7, b5c3, c8c3, g1h1, d7c6, a1b1, c3a3, h3g3, c6d7, a4a5, a3a5, f4f5, e6f5, e5e6, d7e6, e3d4, f7f6, g3g6, a5a8, g6g7, e7d6, g7b7, d6e5, d4e5, e6e5, h1e1, e5d6, e1f1, d6e5, b7e7, e5d6, e7g7, d6e5, f1e1, e5d6, g7f7, h8f8, f7b7, f5f4, e1h1, d6e5, b1b2, f8h8, h1h5, f6f5, b7f7, e5e6, f7f5, h8h7, f5e5, e6d6, e5d5, d6c6, d5c5, c6d6, c5d5, d6c6, d5c5, c6d6, h5d5, d6e6, d5e5, e6d6, e5d5, d6e6, d5e5, e6d6, e5d5, d6e6, d5e5, e6d6, e5d5, d6e6, d5e5, e6d6, e5d5","[0.0038, 0.0034, 0.0019, 0.0025, 0.0031, 0.004, 0.0034, 0.0031, 0.0042, 0.0038, 0.004, 0.0042, 0.004, 0.0041, 0.0029, 0.0026, 0.0039, 0.0038, 0.0025, 0.0023, 0.002, 0.005, 0.0032, 0.0023, 0.0017, 0.0023, 0.0013, 0.003, 0.0044, 0.0043, 0.0048, 0.0036, 0.004, 0.0036, 0.0032, 0.0032, 0.0028, 0.0031, 0.0026, 0.0037, 0.0032, 0.0028, 0.0039, 0.0043, 0.0032, 0.003, 0.0042, 0.0037, 0.0043, 0.0047, 0.0052, 0.0055, 0.0048, 0.0049, 0.0058, 0.006, 0.0055, 0.0055, 0.0067, 0.0069, 0.0057, 0.0053, 0.006, 0.0063, 0.0052, 0.006, 0.0062, 0.0066, 0.0069, 0.0071, 0.0064, 0.008, 0.0063, 0.0023, 0.0029, 0.0025, 0.0028, 0.0021, 0.0045, 0.0038, 0.0024, 0.0013, 0.0011, 0.0014, 0.0013, 0.0012, 0.0012, 0.0013, 0.0008, 0.0007, 0.0012, 0.0009, 0.0015, 0.0001, 0.0006, 0.0, 0.0, 0.0, 0.0, 0.0, 0.0003, 0.0004, 0.0, 0.0003, 0.0, 0.0002, 0.0001, 0.0001, 0.0002, 0.0, 0.0, 0.0, 0.0, 0.0, 0.0, 0.0, 0.0, 0.0, 0.0, 0.0, 0.0, 0.0, 0.0, 0.0, 0.0, 0.0, 0.0, 0.0, 0.0, 0.0, 0.0, 0.0, 0.0, 0.0, 0.0, 0.0, 0.0, 0.0, 0.0, 0.0, 0.0, 0.0]","0, 0, 0, 0, 0, 0, 0, 0, 0, 0, 0, 0, 0, 0, 0, 0, 0, 1, 0, 0, 0, 0, 0, 0, -9, 0, 0, 0, 0, 1, 0, 0, 0, 0, 0, 0, 0, 0, 0, 0, 0, 0, 0, 0, 0, 0, 0, 0, 0, 3, 0, 0, 0, 0, 0, 0, 0, 3, 0, 0, 0, 0, 0, 1, 1, 1, 1, 4, 1, 1, 1, 1, 1, 1, 1, 1, 0, 0, -1, -1, -2, -2, -2, -1, -1, -1, -1, -1, -1, 2, -1, -1, -1, -1, -1, -1, -1, -1, -1, -1, -1, -1, -1, -1, -1, -1, -1, -1, -1, -1, -1, -1, -1, 0, -1, -1, -1, 0, 0, 0, 0, 0, 0, 0, 0, 0, 0, 0, 0, 0, 0, 0, 0, 0, 0, 0, 0, 0, 0, 0, 0, 0",142
Draw,Draw,Stockfish,Stockfish,"g1f3, b8c6, d2d4, e5d4, f3d4, g8f6, d4c6, b7c6, f1d3, d7d5, b1c3, f8b4, e4d5, e8g8, e1g1, c8g4, f2f3, g4h5, d5c6, d8d4, g1h1, b4c3, b2c3, d4c3, c1f4, c3c6, d1e2, a7a6, f1e1, h5g6, d3c4, f8e8, e2f1, f6d5, e1e8, a8e8, f4d2, d5e3, d2e3, e8e3, c4a6, g6c2, f1c1, e3e8, a6d3, c2a4, c1c6, a4c6, h1g1, e8a8, g1f2, a8a5, f2e3, g8f8, d3c2, c6a4, c2d3, a4d7, a2a3, f8e7, e3d2, c7c5, d2c3, e7d6, d3c4, d7e6, c4e2, e6d7, e2d1, d7a4, d1a4, a5a4, c3b3, a4a5, a3a4, h7h5, h2h4, d6d5, a1d1, d5c6, d1e1, f7f6, e1e7, c6d6, e7g7, c5c4, b3b4, c4c3, b4c3, a5a4, g2g3, a4a3, c3d4, a3f3, d4e4, f3f1, g7h7, f6f5, e4e3, f5f4, g3f4, f1h1, h7h5, d6e6, e3e4, e6f6, e4f3, h1f1, f3g3, f1g1, g3f3, g1f1, f3g3, f1c1, h5g5, c1g1, g3h3, g1h1, h3g4, h1g1, g4h3, g1h1, h3g3, h1a1, g3g4, a1g1, g4f3, g1a1, h4h5, a1f1, f3e3, f6f7, g5a5, f1h1, e3f3, f7g7, a5g5, g7h6, f3g4, h1g1, g4f5, g1f1, f5g4, f1g1, g4f5, g1f1, g5g3, f1c1, f5g4, c1a1, g3h3, a1g1, g4f5, g1b1, h3h4, b1g1, f5f6, g1a1, f6f5, a1a8, f5f6, a8f8, f6e5, f8e8, e5f5, e8g8, f5f6, g8f8, f6e5, f8e8, e5f5, e8f8, f5e4, f8e8, e4f3, e8a8, f3g3, a8f8, h4h3, f8g8, g3h4, g8g1, h3g3, g1h1, h4g4, h1a1, g3e3, a1g1, g4f5, g1f1, e3h3, f1b1, h3e3, b1a1, e3f3, a1b1, f5f6, b1b6, f6f5, b6b1, f3h3, b1b5, f5e4, b5b1, e4f5, b1b5, f5g4, b5b2, h3d3, b2g2, g4f5, g2f2, d3h3, f2a2, h3e3, a2a1, e3e6, h6h5, f5f6, a1b1, f4f5, b1b8, f6f7, b8b7, e6e7, b7b6, e7e5, b6b7, e5e7, b7b6, f5f6, h5h6, e7e6, b6b8, f7e7, b8a8, e7f7, a8b8, e6e8, b8b7, e8e7, b7b8, e7e8, b8b7, e8e7, b7b8, e7d7, b8b6, f7e7, b6b8, e7f7, b8a8, f7e7, a8b8, d7d1, b8b7, e7e6, b7b6, d1d6, b6b7, d6d8, b7b6, d8d6, b6b7, d6d7, b7b1, e6f7, b1b6, d7d1, b6b7, f7e6, b7b6, e6f7, b6b7, f7f8, h6g6, d1d6, b7f7, f8e8, f7f6, d6f6, g6f6","[0.0032, 0.0017, 0.0017, 0.0008, 0.0009, 0.0, 0.0014, 0.0017, 0.0008, 0.001, 0.0009, 0.0013, 0.0012, 0.0005, 0.001, 0.0017, 0.0021, 0.0014, 0.0011, 0.0021, 0.0019, 0.0021, 0.0016, 0.0011, 0.0012, 0.0011, 0.0013, 0.0011, 0.0007, 0.002, 0.0006, 0.0003, 0.0004, 0.0001, 0.0001, 0.0006, 0.0007, 0.0004, 0.0003, 0.0002, 0.0001, 0.0001, 0.0001, 0.0, 0.0002, 0.0, 0.0, 0.0, 0.0, 0.0, 0.0003, 0.0, 0.0, 0.0, 0.0, 0.0, 0.0002, 0.0, 0.0, 0.0, 0.0, 0.0, 0.0, 0.0, 0.0, 0.0, 0.0, 0.0, 0.0, 0.0, 0.0, 0.0, 0.0, 0.0, 0.0, 0.0, 0.0, 0.0, 0.0, 0.0, 0.0, 0.0, 0.0, 0.0, 0.0, 0.0, 0.0, 0.0, 0.0, 0.0, 0.0, 0.0, 0.0, 0.0, 0.0, 0.0003, 0.0, 0.0, 0.0, 0.0, 0.0, 0.0, 0.0, 0.0, 0.0, 0.0, 0.0, 0.0, 0.0, 0.0, 0.0, 0.0, 0.0001, 0.0003, 0.0, 0.0, 0.0, 0.0, 0.0, 0.0, 0.0, 0.0, 0.0, 0.0, 0.0, 0.0, 0.0003, 0.0, 0.0, 0.0, 0.0, 0.0, 0.0, 0.0, 0.0, 0.0, 0.0, 0.0, 0.0, 0.0, 0.0, 0.0, 0.0, 0.0, 0.0, 0.0, 0.0, 0.0, 0.0, 0.0, 0.0, 0.0, 0.0, 0.0, 0.0, 0.0, 0.0, 0.0, 0.0, 0.0, 0.0, 0.0, 0.0, 0.0, 0.0, 0.0, 0.0, 0.0, 0.0, 0.0, 0.0, 0.0, 0.0, 0.0, 0.0, 0.0, 0.0, 0.0, 0.0, 0.0, 0.0, 0.0, 0.0, 0.0, 0.0, 0.0, 0.0, 0.0, 0.0, 0.0, 0.0, 0.0, 0.0, 0.0, 0.0, 0.0, 0.0, 0.0, 0.0, 0.0, 0.0, 0.0, 0.0, 0.0, 0.0, 0.0, 0.0, 0.0, 0.0, 0.0, 0.0, 0.0, 0.0, 0.0, 0.0, 0.0, 0.0, 0.0, 0.0, 0.0, 0.0, 0.0, 0.0, 0.0, 0.0, 0.0, 0.0, 0.0, 0.0, 0.0, 0.0, 0.0, 0.0, 0.0, 0.0, 0.0, 0.0, 0.0, 0.0, 0.0, 0.0, 0.0, 0.0, 0.0, 0.0, 0.0, 0.0, 0.0, 0.0, 0.0, 0.0, 0.0, 0.0, 0.0, 0.0, 0.0, 0.0, 0.0, 0.0, 0.0, 0.0, 0.0, 0.0, 0.0, 0.0, 0.0, 0.0, 0.0, 0.0, 0.0, 0.0, 0.0, 0.0, 0.0, 0.0, 0.0, 0.0, 0.0, 0.0, 0.0, 0.0, 0.0]","0, 0, 0, -1, 0, 0, 3, 0, 0, 0, 0, 0, 1, 1, 1, 1, 1, 1, 2, 2, 2, -1, 2, 1, 1, 0, 0, 0, 0, 0, 0, 0, 0, 0, 5, 0, 0, 0, 3, 0, 1, 0, 0, 0, 0, 0, 9, 0, 0, 0, 0, 0, 0, 0, 0, 0, 0, 0, 0, 0, 0, 0, 0, 0, 0, 0, 0, 0, 0, 0, 3, 0, 0, 0, 0, 0, 0, 0, 0, 0, 0, 0, 0, 0, 1, 1, 1, 1, 2, 1, 1, 1, 1, 0, 0, 0, 0, 0, 0, 0, 1, 1, 2, 2, 2, 2, 2, 2, 2, 2, 2, 2, 2, 2, 2, 2, 2, 2, 2, 2, 2, 2, 2, 2, 2, 2, 2, 2, 2, 2, 2, 2, 2, 2, 2, 2, 2, 2, 2, 2, 2, 2, 2, 2, 2, 2, 2, 2, 2, 2, 2, 2, 2, 2, 2, 2, 2, 2, 2, 2, 2, 2, 2, 2, 2, 2, 2, 2, 2, 2, 2, 2, 2, 2, 2, 2, 2, 2, 2, 2, 2, 2, 2, 2, 2, 2, 2, 2, 2, 2, 2, 2, 2, 2, 2, 2, 2, 2, 2, 2, 2, 2, 2, 2, 2, 2, 2, 2, 2, 2, 2, 2, 2, 2, 2, 2, 2, 1, 1, 1, 1, 1, 1, 1, 1, 1, 1, 1, 1, 1, 1, 1, 1, 1, 1, 1, 1, 1, 1, 1, 1, 1, 1, 1, 1, 1, 1, 1, 1, 1, 1, 1, 1, 1, 1, 1, 1, 1, 1, 1, 1, 1, 1, 1, 1, 1, 1, 1, 1, 1, 1, 1, 1, 1, 1, 1, 1, 1, 1, 0, 5, 0",282
White,Black,Stockfish,Stockfish,"g1f3, b8c6, f1b5, a7a6, b5a4, g8f6, e1g1, f6e4, d2d4, b7b5, a4b3, d7d5, d4e5, c8e6, c2c3, f8e7, b1d2, e4c5, b3c2, d5d4, d2b3, d4c3, b3c5, e7c5, c2e4, d8d7, c1g5, c3b2, a1b1, h7h6, b1b2, d7d1, f1d1, e8g8, e4c6, h6g5, c6a8, f8a8, b2c2, c5f8, f3g5, e6c4, f2f4, a6a5, d1d7, f8c5, g1h1, c5e3, g2g3, c7c5, h1g2, a5a4, g2f3, e3d4, c2c4, b5c4, g5f7, a8b8, d7d8, b8d8, f7d8, d4g1, e5e6, g8f8, f4f5, g1h2, g3g4, c4c3, f3e2, h2e5, d8b7, c5c4, b7c5, f8e7, c5a4, e5f6, e2d1, g7g6, a4b6, e7d6, d1c2, d6c6, b6d7, f6g7, f5f6, g7f6, d7f6, c6d6, c2c3, g6g5, f6e4, d6e6, e4g5, e6d5, a2a4, d5e5, g5f3, e5d6, c3c4, d6e7, g4g5, e7d6, a4a5, d6e7, a5a6, e7d6, a6a7, d6e6, g5g6, e6f6, a7a8q, f6g6, a8f8, g6h7, f8f6, h7g8, f3e5, g8h7, f6f7, h7h8, e5g6","[0.0021, 0.0011, 0.0015, 0.0017, 0.0023, 0.0027, 0.0043, 0.0036, 0.0029, 0.0029, 0.0037, 0.0028, 0.0031, 0.0025, 0.0031, 0.0032, 0.0025, 0.0036, 0.0037, 0.0041, 0.0028, 0.0031, 0.0032, 0.0027, 0.0022, 0.0057, 0.0062, 0.0074, 0.0066, 0.0086, 0.0106, 0.0102, 0.0105, 0.0102, 0.0097, 0.0089, 0.0128, 0.0111, 0.0128, 0.0124, 0.0129, 0.013, 0.014, 0.0138, 0.0139, 0.0157, 0.0143, 0.0143, 0.0138, 0.0158, 0.018, 0.0205, 0.0215, 0.0236, 0.0246, 0.0268, 0.0277, 0.0281, 0.0303, 0.0282, 0.0329, 0.0325, 0.0307, 0.0344, 0.0386, 0.0384, 0.0378, 0.0411, 0.0412, 0.0418, 0.0384, 0.0419, 0.0465, 0.0499, 0.0524, 0.0514, 0.0482, 0.0596, 0.0591, 0.0624, 0.0641, 0.0638, 0.0653, 0.067, 0.0741, 0.0801, 0.3508, 0.3527, 0.3479, 0.3811, 0.9979, 0.9982, 0.9985, 0.9985, 0.9986, 0.9986, 0.9988, 0.9988, 0.9989, 0.9989, 0.999, 0.999, 0.9991, 0.9991, 0.9992, 0.9992, 0.9993, 0.9993, 0.9994, 0.9994, 0.9995, 0.9995, 0.9996, 0.9996, 0.9997, 0.9997, 0.9998, 0.9998, 0.9999, 0.9999, 1.0]","0, 0, 0, 0, 0, 0, 0, -1, -1, -1, -1, -1, 0, 0, 0, 0, 0, 0, 0, 0, 0, -1, 2, -1, -1, -1, -1, -2, -2, -2, -1, -10, -1, -1, 2, -1, 4, 1, 1, 1, 2, 2, 2, 2, 2, 2, 2, 2, 2, 2, 2, 2, 2, 2, 5, 0, 1, 1, 1, -4, 1, 1, 1, 1, 1, 0, 0, 0, 0, 0, 0, 0, 0, 0, 1, 1, 1, 1, 1, 1, 1, 1, 1, 1, 1, 0, 3, 3, 4, 4, 4, 3, 4, 4, 4, 4, 4, 4, 5, 5, 5, 5, 5, 5, 5, 5, 5, 5, 5, 5, 13, 12, 12, 12, 12, 12, 12, 12, 12, 12, 12",121
Draw,Draw,Stockfish,Stockfish,"g8f6, b1c3, f8b4, e2e3, e8g8, g1e2, d7d5, c4d5, f6d5, d1b3, d5c3, b2c3, b4d6, e2g3, c7c5, f1e2, b8c6, e1g1, a8b8, f1d1, c8e6, b3c2, b8c8, a1b1, d8d7, c1a3, b7b6, c2b2, f8d8, e2a6, c8c7, b1c1, c6a5, d2d3, d7e8, c3c4, f7f6, g3e4, a5c6, f2f3, f6f5, e4d6, d8d6, a6b5, e6d7, b2e2, h7h6, b5c6, d7c6, a3b2, c7d7, h2h3, d6g6, e2f2, f5f4, e3f4, e5f4, d3d4, d7e7, d1e1, c5d4, e1e7, e8e7, b2d4, e7d7, g1f1, g6g3, c1c3, g3g6, f2d2, d7f5, d4f2, b6b5, c4b5, c6b5, f1g1, f5h3, f2a7, h3e6, a7d4, b5c6, d2f2, h6h5, a2a4, h5h4, f2h4, e6e2, h4d8, g8h7, d4f2, e2b2, c3d3, b2e5, d3d4, c6f3, d8h4, h7g8, h4d8, g8h7, d8h4, h7g8, d4d8, g8f7, d8d7, f7g8, d7d8, g8f7, d8d7, f7g8, d7d8, g8f7, d8d7, f7g8, d7d8, g8f7, d8d7, f7g8, d7d8","[-0.0045, -0.004, -0.0036, -0.0034, -0.0029, -0.0032, -0.003, -0.0045, -0.0033, -0.0029, -0.0027, -0.0046, -0.0035, -0.0025, -0.0026, -0.0029, -0.0027, -0.0031, -0.0035, -0.0022, -0.0031, -0.0016, -0.0039, -0.0034, -0.0028, -0.0032, -0.0028, -0.0029, -0.0028, -0.0024, -0.0032, -0.0029, -0.0039, -0.0034, -0.0045, -0.0043, -0.0036, -0.0029, -0.0042, -0.0044, -0.0043, -0.006, -0.0039, -0.0038, -0.0051, -0.0051, -0.0046, -0.0057, -0.0043, -0.0055, -0.0052, -0.0043, -0.0018, -0.0035, -0.0073, -0.0061, -0.0047, -0.0014, 0.0, -0.0003, 0.0, -0.0004, 0.0, -0.0001, 0.0, 0.0, 0.0, 0.0, 0.0, 0.0, 0.0, 0.0, 0.0, 0.0, 0.0, 0.0, 0.0, 0.0, 0.0, 0.0, 0.0, -0.0014, -0.0003, -0.001, 0.0, 0.0, 0.0, 0.0, 0.0, 0.0, 0.0, 0.0, 0.0, 0.0, 0.0, 0.0, 0.0, 0.0, 0.0, 0.0, 0.0, 0.0, 0.0, 0.0, 0.0, 0.0, 0.0, 0.0, 0.0, 0.0, 0.0, 0.0, 0.0, 0.0, 0.0, 0.0, 0.0, 0.0]","0, 0, 0, 0, 0, 0, 0, 1, 0, 0, -3, 0, 0, 0, 0, 0, 0, 0, 0, 0, 0, 0, 0, 0, 0, 0, 0, 0, 0, 0, 0, 0, 0, 0, 0, 0, 0, 0, 0, 0, 0, 3, 0, 0, 0, 0, 0, 3, 0, 0, 0, 0, 0, 0, 0, 1, 0, 0, 0, 0, -1, 4, -1, 0, 0, 0, 0, 0, 0, 0, 0, 0, 0, 1, 0, 0, -1, 0, 0, 0, 0, 0, 0, 0, 0, 1, 1, 1, 1, 1, 1, 1, 1, 1, 0, 0, 0, 0, 0, 0, 0, 0, 0, 0, 0, 0, 0, 0, 0, 0, 0, 0, 0, 0, 0, 0, 0, 0",118
Draw,Draw,Stockfish,Stockfish,"g1f3, b8c6, f1b5, a7a6, b5a4, g8f6, e1g1, f6e4, d2d4, b7b5, a4b3, d7d5, d4e5, c8e6, b1d2, e4c5, c2c3, d5d4, b3e6, c5e6, c3d4, c6d4, a2a4, f8b4, a4b5, d4b5, d1a4, b4d2, c1d2, e8g8, a4e4, d8d7, f1e1, c7c5, h2h4, b5d4, f3d4, e6d4, d2c3, f8d8, a1a5, d7c8, a5a4, c8e6, c3d4, c5d4, a4d4, a8b8, d4d8, b8d8, e1c1, h7h6, c1c6, e6b3, c6a6, b3b2, a6a8, b2c1, g1h2, c1d1, a8d8, d1d8, h4h5, d8d2, e4a8, g8h7, a8f3, d2d4, f3e2, h7g8, h2h3, d4a1, h3g4, a1d4, g4h3, d4a1, h3g3, a1c3, e2e3, c3c4, f2f3, c4e6, f3f4, e6f5, g3h4, f5b1, h4g4, b1d1, e3f3, d1e1, f3d5, e1e2, d5f3, e2e1, f3a8, g8h7, a8c6, e1e2, c6f3, e2e1, f3a8, e1d1, a8f3, d1e1, f3d3, h7g8, g2g3, g8h8, d3d8, h8h7, d8d3, h7h8, d3f3, h8g8, g4h4, e1d2, f3a8, g8h7, a8e4, h7h8, e4a8, h8h7, a8e4, h7h8, h4g4, d2c1, e4a8, h8h7, a8e4, h7g8, f4f5, c1d2, e4a8, g8h7, a8e4, h7g8, e5e6, d2g5, g4f3, g5h5, f3f4, f7e6, f5e6, h5g5, f4f3, g5h5, g3g4, h5h1, f3e3, h1e4, e3e4, g7g6, e4d5, g8f8, d5e4, f8e7, e4e5, e7e8, e5f6, h6h5, g4h5, g6h5, f6g5, e8e7, g5f4, e7e6, f4g5, h5h4, g5h4","[0.0038, 0.0029, 0.0036, 0.0025, 0.0031, 0.0042, 0.0046, 0.0028, 0.0033, 0.0033, 0.0028, 0.0028, 0.0033, 0.0038, 0.0031, 0.0028, 0.0036, 0.0027, 0.0034, 0.0035, 0.003, 0.0021, 0.0017, 0.0014, 0.0027, 0.0025, 0.0028, 0.0027, 0.0027, 0.0027, 0.0028, 0.0023, 0.0023, 0.0023, 0.0025, 0.003, 0.0029, 0.0026, 0.0027, 0.0029, 0.0023, 0.0031, 0.0022, 0.0025, 0.0022, 0.0025, 0.0024, 0.0023, 0.002, 0.0018, 0.0019, 0.0017, 0.0023, 0.0021, 0.0014, 0.0013, 0.0017, 0.0017, 0.0015, 0.0017, 0.0014, 0.0014, 0.0014, 0.0018, 0.0017, 0.0021, 0.0015, 0.0015, 0.0015, 0.0013, 0.0013, 0.0012, 0.0015, 0.0013, 0.0015, 0.0014, 0.0012, 0.0014, 0.0012, 0.0012, 0.0012, 0.0012, 0.0012, 0.0012, 0.0012, 0.0008, 0.0008, 0.0008, 0.0008, 0.0008, 0.0008, 0.0008, 0.0008, 0.0008, 0.0007, 0.0007, 0.0007, 0.0007, 0.0007, 0.0007, 0.0007, 0.0007, 0.0007, 0.0006, 0.0007, 0.0006, 0.0005, 0.0004, 0.0004, 0.0003, 0.0003, 0.0003, 0.0003, 0.0003, 0.0001, 0.0, 0.0, 0.0, 0.0, 0.0, 0.0, 0.0, 0.0, 0.0003, 0.0004, 0.0002, 0.0002, 0.0, 0.0, 0.0, 0.0, 0.0, 0.0, 0.0, 0.0, 0.0, 0.0, 0.0, 0.0, 0.0, 0.0, 0.0, 0.0, 0.0, 0.0, 0.0, 0.0, 0.0, 0.0, 0.0, 0.0, 0.0, 0.0, 0.0, 0.0, 0.0, 0.0, 0.0, 0.0, 0.0, 0.0, 0.0, 0.0, 0.0, 0.0, 0.0, 0.0, 0.0, 0.0]","0, 0, 0, 0, 0, 0, 0, -1, -1, -1, -1, -1, 0, 0, 0, 0, 0, 0, 3, 0, 1, 0, 0, 0, 1, 0, 0, -3, 0, 0, 0, 0, 0, 0, 0, 0, 3, 0, 0, 0, 0, 0, 0, 0, 3, 0, 1, 1, 6, 1, 1, 1, 1, 1, 2, 1, 1, 1, 1, 1, 6, 1, 1, 1, 1, 1, 1, 1, 1, 1, 1, 1, 1, 1, 1, 1, 1, 1, 1, 1, 1, 1, 1, 1, 1, 1, 1, 1, 1, 1, 1, 1, 1, 1, 1, 1, 1, 1, 1, 1, 1, 1, 1, 1, 1, 1, 1, 1, 1, 1, 1, 1, 1, 1, 1, 1, 1, 1, 1, 1, 1, 1, 1, 1, 1, 1, 1, 1, 1, 1, 1, 1, 1, 1, 1, 1, 1, 1, 1, 0, 0, -1, 0, 0, 0, 0, 0, 0, 0, -9, 0, 0, 0, 0, 0, 0, 0, 0, 0, 0, 1, 0, 0, 0, 0, -1, -1, -1, 0",169
